root@lamponubuntu2204-s-1vcpu-1gb-tor1-01:~# tcpdump -i eth0
tcpdump: verbose output suppressed, use -v[v]... for full protocol decode
listening on eth0, link-type EN10MB (Ethernet), snapshot length 262144 bytes
21:12:35.335147 IP lamponubuntu2204-s-1vcpu-1gb-tor1-01.ssh > pool-99-252-115-234.cpe.net.cable.rogers.com.42082: Flags [P.], seq 567060210:567060262, ack 4106165593, win 501, options [nop,nop,TS val 4229785752 ecr 1279666710], length 52
21:12:35.335772 IP lamponubuntu2204-s-1vcpu-1gb-tor1-01.ssh > pool-99-252-115-234.cpe.net.cable.rogers.com.42082: Flags [P.], seq 52:160, ack 1, win 501, options [nop,nop,TS val 4229785753 ecr 1279666710], length 108
21:12:35.335822 IP lamponubuntu2204-s-1vcpu-1gb-tor1-01.ssh > pool-99-252-115-234.cpe.net.cable.rogers.com.42082: Flags [P.], seq 160:196, ack 1, win 501, options [nop,nop,TS val 4229785753 ecr 1279666710], length 36
21:12:35.335853 IP lamponubuntu2204-s-1vcpu-1gb-tor1-01.ssh > pool-99-252-115-234.cpe.net.cable.rogers.com.42082: Flags [P.], seq 196:248, ack 1, win 501, options [nop,nop,TS val 4229785753 ecr 1279666710], length 52
21:12:35.335882 IP lamponubuntu2204-s-1vcpu-1gb-tor1-01.ssh > pool-99-252-115-234.cpe.net.cable.rogers.com.42082: Flags [P.], seq 248:316, ack 1, win 501, options [nop,nop,TS val 4229785753 ecr 1279666710], length 68
21:12:35.335911 IP lamponubuntu2204-s-1vcpu-1gb-tor1-01.ssh > pool-99-252-115-234.cpe.net.cable.rogers.com.42082: Flags [P.], seq 316:384, ack 1, win 501, options [nop,nop,TS val 4229785753 ecr 1279666710], length 68
21:12:35.335936 IP lamponubuntu2204-s-1vcpu-1gb-tor1-01.ssh > pool-99-252-115-234.cpe.net.cable.rogers.com.42082: Flags [P.], seq 384:420, ack 1, win 501, options [nop,nop,TS val 4229785753 ecr 1279666710], length 36
21:12:35.353366 IP pool-99-252-115-234.cpe.net.cable.rogers.com.42082 > lamponubuntu2204-s-1vcpu-1gb-tor1-01.ssh: Flags [.], ack 160, win 1623, options [nop,nop,TS val 1279666743 ecr 4229785753], length 0
21:12:35.353367 IP pool-99-252-115-234.cpe.net.cable.rogers.com.42082 > lamponubuntu2204-s-1vcpu-1gb-tor1-01.ssh: Flags [.], ack 420, win 1623, options [nop,nop,TS val 1279666743 ecr 4229785753], length 0
21:12:35.434912 IP lamponubuntu2204-s-1vcpu-1gb-tor1-01.39345 > 67.207.67.3.domain: 27308+ [1au] PTR? 234.115.252.99.in-addr.arpa. (56)
21:12:35.435112 IP lamponubuntu2204-s-1vcpu-1gb-tor1-01.57212 > 67.207.67.3.domain: Flags [S], seq 1391488205, win 64240, options [mss 1460,sackOK,TS val 3172956384 ecr 0,nop,wscale 7,tfo  cookiereq,nop,nop], length 0
21:12:35.435393 IP lamponubuntu2204-s-1vcpu-1gb-tor1-01.45408 > 67.207.67.3.domain: 57148+ PTR? 74.38.122.134.in-addr.arpa. (44)
21:12:35.437065 IP 67.207.67.3.domain > lamponubuntu2204-s-1vcpu-1gb-tor1-01.45408: 57148 NXDomain 0/1/0 (111)
21:12:35.437066 IP 67.207.67.3.domain > lamponubuntu2204-s-1vcpu-1gb-tor1-01.39345: 27308 1/0/1 PTR pool-99-252-115-234.cpe.net.cable.rogers.com. (114)
21:12:35.437179 IP 67.207.67.3.domain > lamponubuntu2204-s-1vcpu-1gb-tor1-01.57212: Flags [S.], seq 1725715899, ack 1391488206, win 65160, options [mss 1460,sackOK,TS val 1869484000 ecr 3172956384,nop,wscale 9], length 0
21:12:35.437209 IP lamponubuntu2204-s-1vcpu-1gb-tor1-01.57212 > 67.207.67.3.domain: Flags [.], ack 1, win 502, options [nop,nop,TS val 3172956387 ecr 1869484000], length 0
21:12:35.437576 IP lamponubuntu2204-s-1vcpu-1gb-tor1-01.57212 > 67.207.67.3.domain: Flags [P.], seq 1:48, ack 1, win 502, options [nop,nop,TS val 3172956387 ecr 1869484000], length 47 55093+ PTR? 234.115.252.99.in-addr.arpa. (45)
21:12:35.437750 IP lamponubuntu2204-s-1vcpu-1gb-tor1-01.ssh > pool-99-252-115-234.cpe.net.cable.rogers.com.42082: Flags [P.], seq 420:696, ack 1, win 501, options [nop,nop,TS val 4229785855 ecr 1279666743], length 276
21:12:35.437805 IP lamponubuntu2204-s-1vcpu-1gb-tor1-01.ssh > pool-99-252-115-234.cpe.net.cable.rogers.com.42082: Flags [P.], seq 696:732, ack 1, win 501, options [nop,nop,TS val 4229785855 ecr 1279666743], length 36
21:12:35.437888 IP lamponubuntu2204-s-1vcpu-1gb-tor1-01.ssh > pool-99-252-115-234.cpe.net.cable.rogers.com.42082: Flags [P.], seq 732:984, ack 1, win 501, options [nop,nop,TS val 4229785855 ecr 1279666743], length 252
21:12:35.437918 IP lamponubuntu2204-s-1vcpu-1gb-tor1-01.ssh > pool-99-252-115-234.cpe.net.cable.rogers.com.42082: Flags [P.], seq 984:1020, ack 1, win 501, options [nop,nop,TS val 4229785855 ecr 1279666743], length 36
21:12:35.437957 IP lamponubuntu2204-s-1vcpu-1gb-tor1-01.ssh > pool-99-252-115-234.cpe.net.cable.rogers.com.42082: Flags [P.], seq 1020:1272, ack 1, win 501, options [nop,nop,TS val 4229785855 ecr 1279666743], length 252
21:12:35.437984 IP lamponubuntu2204-s-1vcpu-1gb-tor1-01.ssh > pool-99-252-115-234.cpe.net.cable.rogers.com.42082: Flags [P.], seq 1272:1308, ack 1, win 501, options [nop,nop,TS val 4229785855 ecr 1279666743], length 36
21:12:35.438024 IP lamponubuntu2204-s-1vcpu-1gb-tor1-01.ssh > pool-99-252-115-234.cpe.net.cable.rogers.com.42082: Flags [P.], seq 1308:1560, ack 1, win 501, options [nop,nop,TS val 4229785855 ecr 1279666743], length 252
21:12:35.438057 IP lamponubuntu2204-s-1vcpu-1gb-tor1-01.ssh > pool-99-252-115-234.cpe.net.cable.rogers.com.42082: Flags [P.], seq 1560:1596, ack 1, win 501, options [nop,nop,TS val 4229785855 ecr 1279666743], length 36
21:12:35.438095 IP lamponubuntu2204-s-1vcpu-1gb-tor1-01.ssh > pool-99-252-115-234.cpe.net.cable.rogers.com.42082: Flags [P.], seq 1596:1848, ack 1, win 501, options [nop,nop,TS val 4229785855 ecr 1279666743], length 252
21:12:35.438123 IP lamponubuntu2204-s-1vcpu-1gb-tor1-01.ssh > pool-99-252-115-234.cpe.net.cable.rogers.com.42082: Flags [P.], seq 1848:1884, ack 1, win 501, options [nop,nop,TS val 4229785855 ecr 1279666743], length 36
21:12:35.438225 IP lamponubuntu2204-s-1vcpu-1gb-tor1-01.ssh > pool-99-252-115-234.cpe.net.cable.rogers.com.42082: Flags [P.], seq 1884:2136, ack 1, win 501, options [nop,nop,TS val 4229785856 ecr 1279666743], length 252
21:12:35.438264 IP lamponubuntu2204-s-1vcpu-1gb-tor1-01.ssh > pool-99-252-115-234.cpe.net.cable.rogers.com.42082: Flags [P.], seq 2136:2172, ack 1, win 501, options [nop,nop,TS val 4229785856 ecr 1279666743], length 36
21:12:35.438321 IP lamponubuntu2204-s-1vcpu-1gb-tor1-01.ssh > pool-99-252-115-234.cpe.net.cable.rogers.com.42082: Flags [P.], seq 2172:2424, ack 1, win 501, options [nop,nop,TS val 4229785856 ecr 1279666743], length 252
21:12:35.438354 IP lamponubuntu2204-s-1vcpu-1gb-tor1-01.ssh > pool-99-252-115-234.cpe.net.cable.rogers.com.42082: Flags [P.], seq 2424:2460, ack 1, win 501, options [nop,nop,TS val 4229785856 ecr 1279666743], length 36
21:12:35.438403 IP lamponubuntu2204-s-1vcpu-1gb-tor1-01.ssh > pool-99-252-115-234.cpe.net.cable.rogers.com.42082: Flags [P.], seq 2460:2704, ack 1, win 501, options [nop,nop,TS val 4229785856 ecr 1279666743], length 244
21:12:35.438436 IP lamponubuntu2204-s-1vcpu-1gb-tor1-01.ssh > pool-99-252-115-234.cpe.net.cable.rogers.com.42082: Flags [P.], seq 2704:2740, ack 1, win 501, options [nop,nop,TS val 4229785856 ecr 1279666743], length 36
21:12:35.438473 IP lamponubuntu2204-s-1vcpu-1gb-tor1-01.ssh > pool-99-252-115-234.cpe.net.cable.rogers.com.42082: Flags [P.], seq 2740:2984, ack 1, win 501, options [nop,nop,TS val 4229785856 ecr 1279666743], length 244
21:12:35.438540 IP 67.207.67.3.domain > lamponubuntu2204-s-1vcpu-1gb-tor1-01.57212: Flags [.], ack 48, win 128, options [nop,nop,TS val 1869484001 ecr 3172956387], length 0
21:12:35.438733 IP 67.207.67.3.domain > lamponubuntu2204-s-1vcpu-1gb-tor1-01.57212: Flags [P.], seq 1:106, ack 48, win 128, options [nop,nop,TS val 1869484002 ecr 3172956387], length 105 55093 1/0/0 PTR pool-99-252-115-234.cpe.net.cable.rogers.com. (103)
21:12:35.438770 IP lamponubuntu2204-s-1vcpu-1gb-tor1-01.57212 > 67.207.67.3.domain: Flags [.], ack 106, win 502, options [nop,nop,TS val 3172956388 ecr 1869484002], length 0
21:12:35.452757 IP pool-99-252-115-234.cpe.net.cable.rogers.com.42082 > lamponubuntu2204-s-1vcpu-1gb-tor1-01.ssh: Flags [.], ack 984, win 1620, options [nop,nop,TS val 1279666845 ecr 4229785855], length 0
21:12:35.452757 IP pool-99-252-115-234.cpe.net.cable.rogers.com.42082 > lamponubuntu2204-s-1vcpu-1gb-tor1-01.ssh: Flags [.], ack 1884, win 1615, options [nop,nop,TS val 1279666845 ecr 4229785855], length 0
21:12:35.452828 IP lamponubuntu2204-s-1vcpu-1gb-tor1-01.ssh > pool-99-252-115-234.cpe.net.cable.rogers.com.42082: Flags [P.], seq 2984:3020, ack 1, win 501, options [nop,nop,TS val 4229785870 ecr 1279666845], length 36
21:12:35.459103 IP pool-99-252-115-234.cpe.net.cable.rogers.com.42082 > lamponubuntu2204-s-1vcpu-1gb-tor1-01.ssh: Flags [.], ack 2984, win 1609, options [nop,nop,TS val 1279666845 ecr 4229785856], length 0
21:12:35.467675 IP pool-99-252-115-234.cpe.net.cable.rogers.com.42082 > lamponubuntu2204-s-1vcpu-1gb-tor1-01.ssh: Flags [.], ack 3020, win 1623, options [nop,nop,TS val 1279666861 ecr 4229785870], length 0
21:12:35.538723 IP lamponubuntu2204-s-1vcpu-1gb-tor1-01.46085 > 67.207.67.3.domain: 19203+ [1au] PTR? 3.67.207.67.in-addr.arpa. (53)
21:12:35.538838 IP lamponubuntu2204-s-1vcpu-1gb-tor1-01.52112 > 67.207.67.3.domain: 18972+ PTR? 3.67.207.67.in-addr.arpa. (42)
21:12:35.538888 IP lamponubuntu2204-s-1vcpu-1gb-tor1-01.57212 > 67.207.67.3.domain: Flags [P.], seq 48:92, ack 106, win 502, options [nop,nop,TS val 3172956488 ecr 1869484002], length 44 63672+ PTR? 3.67.207.67.in-addr.arpa. (42)
21:12:35.539960 IP 67.207.67.3.domain > lamponubuntu2204-s-1vcpu-1gb-tor1-01.46085: 19203 NXDomain 0/1/1 (120)
21:12:35.539961 IP 67.207.67.3.domain > lamponubuntu2204-s-1vcpu-1gb-tor1-01.52112: 18972 NXDomain 0/1/0 (109)
21:12:35.540083 IP 67.207.67.3.domain > lamponubuntu2204-s-1vcpu-1gb-tor1-01.57212: Flags [P.], seq 106:217, ack 92, win 128, options [nop,nop,TS val 1869484103 ecr 3172956488], length 111 63672 NXDomain 0/1/0 (109)
21:12:35.540114 IP lamponubuntu2204-s-1vcpu-1gb-tor1-01.57212 > 67.207.67.3.domain: Flags [.], ack 217, win 502, options [nop,nop,TS val 3172956489 ecr 1869484103], length 0
21:12:35.540233 IP lamponubuntu2204-s-1vcpu-1gb-tor1-01.46085 > 67.207.67.3.domain: 19203+ PTR? 3.67.207.67.in-addr.arpa. (42)
21:12:35.542093 IP 67.207.67.3.domain > lamponubuntu2204-s-1vcpu-1gb-tor1-01.46085: 19203 NXDomain 0/1/0 (109)
21:12:35.542712 IP lamponubuntu2204-s-1vcpu-1gb-tor1-01.ssh > pool-99-252-115-234.cpe.net.cable.rogers.com.42082: Flags [P.], seq 3020:3192, ack 1, win 501, options [nop,nop,TS val 4229785960 ecr 1279666861], length 172
21:12:35.542813 IP lamponubuntu2204-s-1vcpu-1gb-tor1-01.ssh > pool-99-252-115-234.cpe.net.cable.rogers.com.42082: Flags [P.], seq 3192:3228, ack 1, win 501, options [nop,nop,TS val 4229785960 ecr 1279666861], length 36
21:12:35.542882 IP lamponubuntu2204-s-1vcpu-1gb-tor1-01.ssh > pool-99-252-115-234.cpe.net.cable.rogers.com.42082: Flags [P.], seq 3228:3480, ack 1, win 501, options [nop,nop,TS val 4229785960 ecr 1279666861], length 252
21:12:35.542911 IP lamponubuntu2204-s-1vcpu-1gb-tor1-01.ssh > pool-99-252-115-234.cpe.net.cable.rogers.com.42082: Flags [P.], seq 3480:3516, ack 1, win 501, options [nop,nop,TS val 4229785960 ecr 1279666861], length 36
21:12:35.542953 IP lamponubuntu2204-s-1vcpu-1gb-tor1-01.ssh > pool-99-252-115-234.cpe.net.cable.rogers.com.42082: Flags [P.], seq 3516:3680, ack 1, win 501, options [nop,nop,TS val 4229785960 ecr 1279666861], length 164
21:12:35.543015 IP lamponubuntu2204-s-1vcpu-1gb-tor1-01.ssh > pool-99-252-115-234.cpe.net.cable.rogers.com.42082: Flags [P.], seq 3680:3716, ack 1, win 501, options [nop,nop,TS val 4229785960 ecr 1279666861], length 36
21:12:35.543039 IP lamponubuntu2204-s-1vcpu-1gb-tor1-01.ssh > pool-99-252-115-234.cpe.net.cable.rogers.com.42082: Flags [P.], seq 3716:3864, ack 1, win 501, options [nop,nop,TS val 4229785960 ecr 1279666861], length 148
21:12:35.543128 IP lamponubuntu2204-s-1vcpu-1gb-tor1-01.ssh > pool-99-252-115-234.cpe.net.cable.rogers.com.42082: Flags [P.], seq 3864:3900, ack 1, win 501, options [nop,nop,TS val 4229785960 ecr 1279666861], length 36
21:12:35.543164 IP lamponubuntu2204-s-1vcpu-1gb-tor1-01.ssh > pool-99-252-115-234.cpe.net.cable.rogers.com.42082: Flags [P.], seq 3900:4088, ack 1, win 501, options [nop,nop,TS val 4229785961 ecr 1279666861], length 188
21:12:35.543201 IP lamponubuntu2204-s-1vcpu-1gb-tor1-01.ssh > pool-99-252-115-234.cpe.net.cable.rogers.com.42082: Flags [P.], seq 4088:4124, ack 1, win 501, options [nop,nop,TS val 4229785961 ecr 1279666861], length 36
21:12:35.543267 IP lamponubuntu2204-s-1vcpu-1gb-tor1-01.ssh > pool-99-252-115-234.cpe.net.cable.rogers.com.42082: Flags [P.], seq 4124:4384, ack 1, win 501, options [nop,nop,TS val 4229785961 ecr 1279666861], length 260
21:12:35.543323 IP lamponubuntu2204-s-1vcpu-1gb-tor1-01.ssh > pool-99-252-115-234.cpe.net.cable.rogers.com.42082: Flags [P.], seq 4384:4420, ack 1, win 501, options [nop,nop,TS val 4229785961 ecr 1279666861], length 36
21:12:35.543333 IP lamponubuntu2204-s-1vcpu-1gb-tor1-01.ssh > pool-99-252-115-234.cpe.net.cable.rogers.com.42082: Flags [P.], seq 4420:4632, ack 1, win 501, options [nop,nop,TS val 4229785961 ecr 1279666861], length 212
21:12:35.543354 IP lamponubuntu2204-s-1vcpu-1gb-tor1-01.ssh > pool-99-252-115-234.cpe.net.cable.rogers.com.42082: Flags [P.], seq 4632:4668, ack 1, win 501, options [nop,nop,TS val 4229785961 ecr 1279666861], length 36
21:12:35.543396 IP lamponubuntu2204-s-1vcpu-1gb-tor1-01.ssh > pool-99-252-115-234.cpe.net.cable.rogers.com.42082: Flags [P.], seq 4668:4936, ack 1, win 501, options [nop,nop,TS val 4229785961 ecr 1279666861], length 268
21:12:35.543423 IP lamponubuntu2204-s-1vcpu-1gb-tor1-01.ssh > pool-99-252-115-234.cpe.net.cable.rogers.com.42082: Flags [P.], seq 4936:4972, ack 1, win 501, options [nop,nop,TS val 4229785961 ecr 1279666861], length 36
21:12:35.543462 IP lamponubuntu2204-s-1vcpu-1gb-tor1-01.ssh > pool-99-252-115-234.cpe.net.cable.rogers.com.42082: Flags [P.], seq 4972:5224, ack 1, win 501, options [nop,nop,TS val 4229785961 ecr 1279666861], length 252
21:12:35.543488 IP lamponubuntu2204-s-1vcpu-1gb-tor1-01.ssh > pool-99-252-115-234.cpe.net.cable.rogers.com.42082: Flags [P.], seq 5224:5260, ack 1, win 501, options [nop,nop,TS val 4229785961 ecr 1279666861], length 36
21:12:35.543525 IP lamponubuntu2204-s-1vcpu-1gb-tor1-01.ssh > pool-99-252-115-234.cpe.net.cable.rogers.com.42082: Flags [P.], seq 5260:5512, ack 1, win 501, options [nop,nop,TS val 4229785961 ecr 1279666861], length 252
21:12:35.543551 IP lamponubuntu2204-s-1vcpu-1gb-tor1-01.ssh > pool-99-252-115-234.cpe.net.cable.rogers.com.42082: Flags [P.], seq 5512:5548, ack 1, win 501, options [nop,nop,TS val 4229785961 ecr 1279666861], length 36
21:12:35.543589 IP lamponubuntu2204-s-1vcpu-1gb-tor1-01.ssh > pool-99-252-115-234.cpe.net.cable.rogers.com.42082: Flags [P.], seq 5548:5800, ack 1, win 501, options [nop,nop,TS val 4229785961 ecr 1279666861], length 252
21:12:35.543618 IP lamponubuntu2204-s-1vcpu-1gb-tor1-01.ssh > pool-99-252-115-234.cpe.net.cable.rogers.com.42082: Flags [P.], seq 5800:5836, ack 1, win 501, options [nop,nop,TS val 4229785961 ecr 1279666861], length 36
21:12:35.543654 IP lamponubuntu2204-s-1vcpu-1gb-tor1-01.ssh > pool-99-252-115-234.cpe.net.cable.rogers.com.42082: Flags [P.], seq 5836:6088, ack 1, win 501, options [nop,nop,TS val 4229785961 ecr 1279666861], length 252
21:12:35.543689 IP lamponubuntu2204-s-1vcpu-1gb-tor1-01.ssh > pool-99-252-115-234.cpe.net.cable.rogers.com.42082: Flags [P.], seq 6088:6124, ack 1, win 501, options [nop,nop,TS val 4229785961 ecr 1279666861], length 36
21:12:35.543725 IP lamponubuntu2204-s-1vcpu-1gb-tor1-01.ssh > pool-99-252-115-234.cpe.net.cable.rogers.com.42082: Flags [P.], seq 6124:6384, ack 1, win 501, options [nop,nop,TS val 4229785961 ecr 1279666861], length 260
21:12:35.543796 IP lamponubuntu2204-s-1vcpu-1gb-tor1-01.ssh > pool-99-252-115-234.cpe.net.cable.rogers.com.42082: Flags [P.], seq 6384:6672, ack 1, win 501, options [nop,nop,TS val 4229785961 ecr 1279666861], length 288
21:12:35.544021 IP lamponubuntu2204-s-1vcpu-1gb-tor1-01.ssh > pool-99-252-115-234.cpe.net.cable.rogers.com.42082: Flags [P.], seq 6672:8172, ack 1, win 501, options [nop,nop,TS val 4229785961 ecr 1279666861], length 1500
21:12:35.544230 IP lamponubuntu2204-s-1vcpu-1gb-tor1-01.ssh > pool-99-252-115-234.cpe.net.cable.rogers.com.42082: Flags [P.], seq 8172:9888, ack 1, win 501, options [nop,nop,TS val 4229785962 ecr 1279666861], length 1716
21:12:35.544258 IP lamponubuntu2204-s-1vcpu-1gb-tor1-01.ssh > pool-99-252-115-234.cpe.net.cable.rogers.com.42082: Flags [P.], seq 9888:9924, ack 1, win 501, options [nop,nop,TS val 4229785962 ecr 1279666861], length 36
21:12:35.544295 IP lamponubuntu2204-s-1vcpu-1gb-tor1-01.ssh > pool-99-252-115-234.cpe.net.cable.rogers.com.42082: Flags [P.], seq 9924:10136, ack 1, win 501, options [nop,nop,TS val 4229785962 ecr 1279666861], length 212
21:12:35.544321 IP lamponubuntu2204-s-1vcpu-1gb-tor1-01.ssh > pool-99-252-115-234.cpe.net.cable.rogers.com.42082: Flags [P.], seq 10136:10172, ack 1, win 501, options [nop,nop,TS val 4229785962 ecr 1279666861], length 36
21:12:35.544364 IP lamponubuntu2204-s-1vcpu-1gb-tor1-01.ssh > pool-99-252-115-234.cpe.net.cable.rogers.com.42082: Flags [P.], seq 10172:10464, ack 1, win 501, options [nop,nop,TS val 4229785962 ecr 1279666861], length 292
21:12:35.544404 IP lamponubuntu2204-s-1vcpu-1gb-tor1-01.ssh > pool-99-252-115-234.cpe.net.cable.rogers.com.42082: Flags [P.], seq 10464:10500, ack 1, win 501, options [nop,nop,TS val 4229785962 ecr 1279666861], length 36
21:12:35.560907 IP pool-99-252-115-234.cpe.net.cable.rogers.com.42082 > lamponubuntu2204-s-1vcpu-1gb-tor1-01.ssh: Flags [.], ack 10500, win 1623, options [nop,nop,TS val 1279666951 ecr 4229785961], length 0
21:12:35.560975 IP lamponubuntu2204-s-1vcpu-1gb-tor1-01.ssh > pool-99-252-115-234.cpe.net.cable.rogers.com.42082: Flags [P.], seq 10500:12156, ack 1, win 501, options [nop,nop,TS val 4229785978 ecr 1279666951], length 1656
21:12:35.573570 IP pool-99-252-115-234.cpe.net.cable.rogers.com.42082 > lamponubuntu2204-s-1vcpu-1gb-tor1-01.ssh: Flags [.], ack 12156, win 1623, options [nop,nop,TS val 1279666969 ecr 4229785978], length 0
21:12:35.642430 IP lamponubuntu2204-s-1vcpu-1gb-tor1-01.ssh > pool-99-252-115-234.cpe.net.cable.rogers.com.42082: Flags [P.], seq 12156:12328, ack 1, win 501, options [nop,nop,TS val 4229786060 ecr 1279666969], length 172
21:12:35.642523 IP lamponubuntu2204-s-1vcpu-1gb-tor1-01.ssh > pool-99-252-115-234.cpe.net.cable.rogers.com.42082: Flags [P.], seq 12328:12528, ack 1, win 501, options [nop,nop,TS val 4229786060 ecr 1279666969], length 200
21:12:35.642562 IP lamponubuntu2204-s-1vcpu-1gb-tor1-01.ssh > pool-99-252-115-234.cpe.net.cable.rogers.com.42082: Flags [P.], seq 12528:12564, ack 1, win 501, options [nop,nop,TS val 4229786060 ecr 1279666969], length 36
21:12:35.642611 IP lamponubuntu2204-s-1vcpu-1gb-tor1-01.ssh > pool-99-252-115-234.cpe.net.cable.rogers.com.42082: Flags [P.], seq 12564:12832, ack 1, win 501, options [nop,nop,TS val 4229786060 ecr 1279666969], length 268
21:12:35.642638 IP lamponubuntu2204-s-1vcpu-1gb-tor1-01.ssh > pool-99-252-115-234.cpe.net.cable.rogers.com.42082: Flags [P.], seq 12832:12868, ack 1, win 501, options [nop,nop,TS val 4229786060 ecr 1279666969], length 36
21:12:35.642676 IP lamponubuntu2204-s-1vcpu-1gb-tor1-01.ssh > pool-99-252-115-234.cpe.net.cable.rogers.com.42082: Flags [P.], seq 12868:13016, ack 1, win 501, options [nop,nop,TS val 4229786060 ecr 1279666969], length 148
21:12:35.642754 IP lamponubuntu2204-s-1vcpu-1gb-tor1-01.ssh > pool-99-252-115-234.cpe.net.cable.rogers.com.42082: Flags [P.], seq 13016:13052, ack 1, win 501, options [nop,nop,TS val 4229786060 ecr 1279666969], length 36
21:12:35.642815 IP lamponubuntu2204-s-1vcpu-1gb-tor1-01.ssh > pool-99-252-115-234.cpe.net.cable.rogers.com.42082: Flags [P.], seq 13052:13200, ack 1, win 501, options [nop,nop,TS val 4229786060 ecr 1279666969], length 148
21:12:35.642845 IP lamponubuntu2204-s-1vcpu-1gb-tor1-01.ssh > pool-99-252-115-234.cpe.net.cable.rogers.com.42082: Flags [P.], seq 13200:13236, ack 1, win 501, options [nop,nop,TS val 4229786060 ecr 1279666969], length 36
21:12:35.642887 IP lamponubuntu2204-s-1vcpu-1gb-tor1-01.ssh > pool-99-252-115-234.cpe.net.cable.rogers.com.42082: Flags [P.], seq 13236:13488, ack 1, win 501, options [nop,nop,TS val 4229786060 ecr 1279666969], length 252
21:12:35.642913 IP lamponubuntu2204-s-1vcpu-1gb-tor1-01.ssh > pool-99-252-115-234.cpe.net.cable.rogers.com.42082: Flags [P.], seq 13488:13524, ack 1, win 501, options [nop,nop,TS val 4229786060 ecr 1279666969], length 36
21:12:35.642950 IP lamponubuntu2204-s-1vcpu-1gb-tor1-01.ssh > pool-99-252-115-234.cpe.net.cable.rogers.com.42082: Flags [P.], seq 13524:13736, ack 1, win 501, options [nop,nop,TS val 4229786060 ecr 1279666969], length 212
21:12:35.642976 IP lamponubuntu2204-s-1vcpu-1gb-tor1-01.ssh > pool-99-252-115-234.cpe.net.cable.rogers.com.42082: Flags [P.], seq 13736:13772, ack 1, win 501, options [nop,nop,TS val 4229786060 ecr 1279666969], length 36
21:12:35.643013 IP lamponubuntu2204-s-1vcpu-1gb-tor1-01.ssh > pool-99-252-115-234.cpe.net.cable.rogers.com.42082: Flags [P.], seq 13772:13936, ack 1, win 501, options [nop,nop,TS val 4229786060 ecr 1279666969], length 164
21:12:35.643039 IP lamponubuntu2204-s-1vcpu-1gb-tor1-01.ssh > pool-99-252-115-234.cpe.net.cable.rogers.com.42082: Flags [P.], seq 13936:13972, ack 1, win 501, options [nop,nop,TS val 4229786060 ecr 1279666969], length 36
21:12:35.643073 IP lamponubuntu2204-s-1vcpu-1gb-tor1-01.ssh > pool-99-252-115-234.cpe.net.cable.rogers.com.42082: Flags [P.], seq 13972:14120, ack 1, win 501, options [nop,nop,TS val 4229786060 ecr 1279666969], length 148
21:12:35.643100 IP lamponubuntu2204-s-1vcpu-1gb-tor1-01.ssh > pool-99-252-115-234.cpe.net.cable.rogers.com.42082: Flags [P.], seq 14120:14156, ack 1, win 501, options [nop,nop,TS val 4229786060 ecr 1279666969], length 36
21:12:35.643137 IP lamponubuntu2204-s-1vcpu-1gb-tor1-01.ssh > pool-99-252-115-234.cpe.net.cable.rogers.com.42082: Flags [P.], seq 14156:14416, ack 1, win 501, options [nop,nop,TS val 4229786060 ecr 1279666969], length 260
21:12:35.643175 IP lamponubuntu2204-s-1vcpu-1gb-tor1-01.ssh > pool-99-252-115-234.cpe.net.cable.rogers.com.42082: Flags [P.], seq 14416:14452, ack 1, win 501, options [nop,nop,TS val 4229786061 ecr 1279666969], length 36
21:12:35.643222 IP lamponubuntu2204-s-1vcpu-1gb-tor1-01.ssh > pool-99-252-115-234.cpe.net.cable.rogers.com.42082: Flags [P.], seq 14452:14704, ack 1, win 501, options [nop,nop,TS val 4229786061 ecr 1279666969], length 252
21:12:35.643249 IP lamponubuntu2204-s-1vcpu-1gb-tor1-01.ssh > pool-99-252-115-234.cpe.net.cable.rogers.com.42082: Flags [P.], seq 14704:14740, ack 1, win 501, options [nop,nop,TS val 4229786061 ecr 1279666969], length 36
21:12:35.643290 IP lamponubuntu2204-s-1vcpu-1gb-tor1-01.ssh > pool-99-252-115-234.cpe.net.cable.rogers.com.42082: Flags [P.], seq 14740:15000, ack 1, win 501, options [nop,nop,TS val 4229786061 ecr 1279666969], length 260
21:12:35.643327 IP lamponubuntu2204-s-1vcpu-1gb-tor1-01.ssh > pool-99-252-115-234.cpe.net.cable.rogers.com.42082: Flags [P.], seq 15000:15036, ack 1, win 501, options [nop,nop,TS val 4229786061 ecr 1279666969], length 36
21:12:35.643369 IP lamponubuntu2204-s-1vcpu-1gb-tor1-01.ssh > pool-99-252-115-234.cpe.net.cable.rogers.com.42082: Flags [P.], seq 15036:15288, ack 1, win 501, options [nop,nop,TS val 4229786061 ecr 1279666969], length 252
21:12:35.643396 IP lamponubuntu2204-s-1vcpu-1gb-tor1-01.ssh > pool-99-252-115-234.cpe.net.cable.rogers.com.42082: Flags [P.], seq 15288:15324, ack 1, win 501, options [nop,nop,TS val 4229786061 ecr 1279666969], length 36
21:12:35.643433 IP lamponubuntu2204-s-1vcpu-1gb-tor1-01.ssh > pool-99-252-115-234.cpe.net.cable.rogers.com.42082: Flags [P.], seq 15324:15584, ack 1, win 501, options [nop,nop,TS val 4229786061 ecr 1279666969], length 260
21:12:35.643460 IP lamponubuntu2204-s-1vcpu-1gb-tor1-01.ssh > pool-99-252-115-234.cpe.net.cable.rogers.com.42082: Flags [P.], seq 15584:15620, ack 1, win 501, options [nop,nop,TS val 4229786061 ecr 1279666969], length 36
21:12:35.643496 IP lamponubuntu2204-s-1vcpu-1gb-tor1-01.ssh > pool-99-252-115-234.cpe.net.cable.rogers.com.42082: Flags [P.], seq 15620:15872, ack 1, win 501, options [nop,nop,TS val 4229786061 ecr 1279666969], length 252
21:12:35.643522 IP lamponubuntu2204-s-1vcpu-1gb-tor1-01.ssh > pool-99-252-115-234.cpe.net.cable.rogers.com.42082: Flags [P.], seq 15872:15908, ack 1, win 501, options [nop,nop,TS val 4229786061 ecr 1279666969], length 36
21:12:35.643558 IP lamponubuntu2204-s-1vcpu-1gb-tor1-01.ssh > pool-99-252-115-234.cpe.net.cable.rogers.com.42082: Flags [P.], seq 15908:16168, ack 1, win 501, options [nop,nop,TS val 4229786061 ecr 1279666969], length 260
21:12:35.643584 IP lamponubuntu2204-s-1vcpu-1gb-tor1-01.ssh > pool-99-252-115-234.cpe.net.cable.rogers.com.42082: Flags [P.], seq 16168:16204, ack 1, win 501, options [nop,nop,TS val 4229786061 ecr 1279666969], length 36
21:12:35.643621 IP lamponubuntu2204-s-1vcpu-1gb-tor1-01.ssh > pool-99-252-115-234.cpe.net.cable.rogers.com.42082: Flags [P.], seq 16204:16456, ack 1, win 501, options [nop,nop,TS val 4229786061 ecr 1279666969], length 252
21:12:35.643648 IP lamponubuntu2204-s-1vcpu-1gb-tor1-01.ssh > pool-99-252-115-234.cpe.net.cable.rogers.com.42082: Flags [P.], seq 16456:16492, ack 1, win 501, options [nop,nop,TS val 4229786061 ecr 1279666969], length 36
21:12:35.643684 IP lamponubuntu2204-s-1vcpu-1gb-tor1-01.ssh > pool-99-252-115-234.cpe.net.cable.rogers.com.42082: Flags [P.], seq 16492:16752, ack 1, win 501, options [nop,nop,TS val 4229786061 ecr 1279666969], length 260
21:12:35.643717 IP lamponubuntu2204-s-1vcpu-1gb-tor1-01.ssh > pool-99-252-115-234.cpe.net.cable.rogers.com.42082: Flags [P.], seq 16752:16788, ack 1, win 501, options [nop,nop,TS val 4229786061 ecr 1279666969], length 36
21:12:35.643754 IP lamponubuntu2204-s-1vcpu-1gb-tor1-01.ssh > pool-99-252-115-234.cpe.net.cable.rogers.com.42082: Flags [P.], seq 16788:17040, ack 1, win 501, options [nop,nop,TS val 4229786061 ecr 1279666969], length 252
21:12:35.643780 IP lamponubuntu2204-s-1vcpu-1gb-tor1-01.ssh > pool-99-252-115-234.cpe.net.cable.rogers.com.42082: Flags [P.], seq 17040:17076, ack 1, win 501, options [nop,nop,TS val 4229786061 ecr 1279666969], length 36
21:12:35.643818 IP lamponubuntu2204-s-1vcpu-1gb-tor1-01.ssh > pool-99-252-115-234.cpe.net.cable.rogers.com.42082: Flags [P.], seq 17076:17336, ack 1, win 501, options [nop,nop,TS val 4229786061 ecr 1279666969], length 260
21:12:35.643845 IP lamponubuntu2204-s-1vcpu-1gb-tor1-01.ssh > pool-99-252-115-234.cpe.net.cable.rogers.com.42082: Flags [P.], seq 17336:17372, ack 1, win 501, options [nop,nop,TS val 4229786061 ecr 1279666969], length 36
21:12:35.643881 IP lamponubuntu2204-s-1vcpu-1gb-tor1-01.ssh > pool-99-252-115-234.cpe.net.cable.rogers.com.42082: Flags [P.], seq 17372:17624, ack 1, win 501, options [nop,nop,TS val 4229786061 ecr 1279666969], length 252
21:12:35.643908 IP lamponubuntu2204-s-1vcpu-1gb-tor1-01.ssh > pool-99-252-115-234.cpe.net.cable.rogers.com.42082: Flags [P.], seq 17624:17660, ack 1, win 501, options [nop,nop,TS val 4229786061 ecr 1279666969], length 36
21:12:35.643961 IP lamponubuntu2204-s-1vcpu-1gb-tor1-01.ssh > pool-99-252-115-234.cpe.net.cable.rogers.com.42082: Flags [P.], seq 17660:17920, ack 1, win 501, options [nop,nop,TS val 4229786061 ecr 1279666969], length 260
21:12:35.643987 IP lamponubuntu2204-s-1vcpu-1gb-tor1-01.ssh > pool-99-252-115-234.cpe.net.cable.rogers.com.42082: Flags [P.], seq 17920:17956, ack 1, win 501, options [nop,nop,TS val 4229786061 ecr 1279666969], length 36
21:12:35.644024 IP lamponubuntu2204-s-1vcpu-1gb-tor1-01.ssh > pool-99-252-115-234.cpe.net.cable.rogers.com.42082: Flags [P.], seq 17956:18208, ack 1, win 501, options [nop,nop,TS val 4229786061 ecr 1279666969], length 252
21:12:35.644050 IP lamponubuntu2204-s-1vcpu-1gb-tor1-01.ssh > pool-99-252-115-234.cpe.net.cable.rogers.com.42082: Flags [P.], seq 18208:18244, ack 1, win 501, options [nop,nop,TS val 4229786061 ecr 1279666969], length 36
21:12:35.644085 IP lamponubuntu2204-s-1vcpu-1gb-tor1-01.ssh > pool-99-252-115-234.cpe.net.cable.rogers.com.42082: Flags [P.], seq 18244:18504, ack 1, win 501, options [nop,nop,TS val 4229786061 ecr 1279666969], length 260
21:12:35.644111 IP lamponubuntu2204-s-1vcpu-1gb-tor1-01.ssh > pool-99-252-115-234.cpe.net.cable.rogers.com.42082: Flags [P.], seq 18504:18540, ack 1, win 501, options [nop,nop,TS val 4229786061 ecr 1279666969], length 36
21:12:35.644148 IP lamponubuntu2204-s-1vcpu-1gb-tor1-01.ssh > pool-99-252-115-234.cpe.net.cable.rogers.com.42082: Flags [P.], seq 18540:18792, ack 1, win 501, options [nop,nop,TS val 4229786061 ecr 1279666969], length 252
21:12:35.644175 IP lamponubuntu2204-s-1vcpu-1gb-tor1-01.ssh > pool-99-252-115-234.cpe.net.cable.rogers.com.42082: Flags [P.], seq 18792:18828, ack 1, win 501, options [nop,nop,TS val 4229786062 ecr 1279666969], length 36
21:12:35.644211 IP lamponubuntu2204-s-1vcpu-1gb-tor1-01.ssh > pool-99-252-115-234.cpe.net.cable.rogers.com.42082: Flags [P.], seq 18828:19088, ack 1, win 501, options [nop,nop,TS val 4229786062 ecr 1279666969], length 260
21:12:35.644250 IP lamponubuntu2204-s-1vcpu-1gb-tor1-01.ssh > pool-99-252-115-234.cpe.net.cable.rogers.com.42082: Flags [P.], seq 19088:19124, ack 1, win 501, options [nop,nop,TS val 4229786062 ecr 1279666969], length 36
21:12:35.644306 IP lamponubuntu2204-s-1vcpu-1gb-tor1-01.ssh > pool-99-252-115-234.cpe.net.cable.rogers.com.42082: Flags [P.], seq 19124:19376, ack 1, win 501, options [nop,nop,TS val 4229786062 ecr 1279666969], length 252
21:12:35.644342 IP lamponubuntu2204-s-1vcpu-1gb-tor1-01.ssh > pool-99-252-115-234.cpe.net.cable.rogers.com.42082: Flags [P.], seq 19376:19412, ack 1, win 501, options [nop,nop,TS val 4229786062 ecr 1279666969], length 36
21:12:35.644392 IP lamponubuntu2204-s-1vcpu-1gb-tor1-01.ssh > pool-99-252-115-234.cpe.net.cable.rogers.com.42082: Flags [P.], seq 19412:19672, ack 1, win 501, options [nop,nop,TS val 4229786062 ecr 1279666969], length 260
21:12:35.644419 IP lamponubuntu2204-s-1vcpu-1gb-tor1-01.ssh > pool-99-252-115-234.cpe.net.cable.rogers.com.42082: Flags [P.], seq 19672:19708, ack 1, win 501, options [nop,nop,TS val 4229786062 ecr 1279666969], length 36
21:12:35.644457 IP lamponubuntu2204-s-1vcpu-1gb-tor1-01.ssh > pool-99-252-115-234.cpe.net.cable.rogers.com.42082: Flags [P.], seq 19708:19960, ack 1, win 501, options [nop,nop,TS val 4229786062 ecr 1279666969], length 252
21:12:35.644484 IP lamponubuntu2204-s-1vcpu-1gb-tor1-01.ssh > pool-99-252-115-234.cpe.net.cable.rogers.com.42082: Flags [P.], seq 19960:19996, ack 1, win 501, options [nop,nop,TS val 4229786062 ecr 1279666969], length 36
21:12:35.644521 IP lamponubuntu2204-s-1vcpu-1gb-tor1-01.ssh > pool-99-252-115-234.cpe.net.cable.rogers.com.42082: Flags [P.], seq 19996:20256, ack 1, win 501, options [nop,nop,TS val 4229786062 ecr 1279666969], length 260
21:12:35.644547 IP lamponubuntu2204-s-1vcpu-1gb-tor1-01.ssh > pool-99-252-115-234.cpe.net.cable.rogers.com.42082: Flags [P.], seq 20256:20292, ack 1, win 501, options [nop,nop,TS val 4229786062 ecr 1279666969], length 36
21:12:35.644584 IP lamponubuntu2204-s-1vcpu-1gb-tor1-01.ssh > pool-99-252-115-234.cpe.net.cable.rogers.com.42082: Flags [P.], seq 20292:20544, ack 1, win 501, options [nop,nop,TS val 4229786062 ecr 1279666969], length 252
21:12:35.644610 IP lamponubuntu2204-s-1vcpu-1gb-tor1-01.ssh > pool-99-252-115-234.cpe.net.cable.rogers.com.42082: Flags [P.], seq 20544:20580, ack 1, win 501, options [nop,nop,TS val 4229786062 ecr 1279666969], length 36
21:12:35.644646 IP lamponubuntu2204-s-1vcpu-1gb-tor1-01.ssh > pool-99-252-115-234.cpe.net.cable.rogers.com.42082: Flags [P.], seq 20580:20840, ack 1, win 501, options [nop,nop,TS val 4229786062 ecr 1279666969], length 260
21:12:35.644672 IP lamponubuntu2204-s-1vcpu-1gb-tor1-01.ssh > pool-99-252-115-234.cpe.net.cable.rogers.com.42082: Flags [P.], seq 20840:20876, ack 1, win 501, options [nop,nop,TS val 4229786062 ecr 1279666969], length 36
21:12:35.644709 IP lamponubuntu2204-s-1vcpu-1gb-tor1-01.ssh > pool-99-252-115-234.cpe.net.cable.rogers.com.42082: Flags [P.], seq 20876:21128, ack 1, win 501, options [nop,nop,TS val 4229786062 ecr 1279666969], length 252
21:12:35.644736 IP lamponubuntu2204-s-1vcpu-1gb-tor1-01.ssh > pool-99-252-115-234.cpe.net.cable.rogers.com.42082: Flags [P.], seq 21128:21164, ack 1, win 501, options [nop,nop,TS val 4229786062 ecr 1279666969], length 36
21:12:35.644771 IP lamponubuntu2204-s-1vcpu-1gb-tor1-01.ssh > pool-99-252-115-234.cpe.net.cable.rogers.com.42082: Flags [P.], seq 21164:21424, ack 1, win 501, options [nop,nop,TS val 4229786062 ecr 1279666969], length 260
21:12:35.644811 IP lamponubuntu2204-s-1vcpu-1gb-tor1-01.ssh > pool-99-252-115-234.cpe.net.cable.rogers.com.42082: Flags [P.], seq 21424:21460, ack 1, win 501, options [nop,nop,TS val 4229786062 ecr 1279666969], length 36
21:12:35.644850 IP lamponubuntu2204-s-1vcpu-1gb-tor1-01.ssh > pool-99-252-115-234.cpe.net.cable.rogers.com.42082: Flags [P.], seq 21460:21720, ack 1, win 501, options [nop,nop,TS val 4229786062 ecr 1279666969], length 260
21:12:35.644876 IP lamponubuntu2204-s-1vcpu-1gb-tor1-01.ssh > pool-99-252-115-234.cpe.net.cable.rogers.com.42082: Flags [P.], seq 21720:21756, ack 1, win 501, options [nop,nop,TS val 4229786062 ecr 1279666969], length 36
21:12:35.644913 IP lamponubuntu2204-s-1vcpu-1gb-tor1-01.ssh > pool-99-252-115-234.cpe.net.cable.rogers.com.42082: Flags [P.], seq 21756:22016, ack 1, win 501, options [nop,nop,TS val 4229786062 ecr 1279666969], length 260
21:12:35.664341 IP pool-99-252-115-234.cpe.net.cable.rogers.com.42082 > lamponubuntu2204-s-1vcpu-1gb-tor1-01.ssh: Flags [.], ack 16168, win 1623, options [nop,nop,TS val 1279667051 ecr 4229786061], length 0
21:12:35.664342 IP pool-99-252-115-234.cpe.net.cable.rogers.com.42082 > lamponubuntu2204-s-1vcpu-1gb-tor1-01.ssh: Flags [.], ack 22016, win 1623, options [nop,nop,TS val 1279667052 ecr 4229786062], length 0
21:12:35.664414 IP lamponubuntu2204-s-1vcpu-1gb-tor1-01.ssh > pool-99-252-115-234.cpe.net.cable.rogers.com.42082: Flags [P.], seq 22016:24676, ack 1, win 501, options [nop,nop,TS val 4229786082 ecr 1279667051], length 2660
21:12:35.679372 IP pool-99-252-115-234.cpe.net.cable.rogers.com.42082 > lamponubuntu2204-s-1vcpu-1gb-tor1-01.ssh: Flags [.], ack 24676, win 1623, options [nop,nop,TS val 1279667072 ecr 4229786082], length 0
21:12:35.746477 IP lamponubuntu2204-s-1vcpu-1gb-tor1-01.ssh > pool-99-252-115-234.cpe.net.cable.rogers.com.42082: Flags [P.], seq 24676:24936, ack 1, win 501, options [nop,nop,TS val 4229786164 ecr 1279667072], length 260
21:12:35.746586 IP lamponubuntu2204-s-1vcpu-1gb-tor1-01.ssh > pool-99-252-115-234.cpe.net.cable.rogers.com.42082: Flags [P.], seq 24936:24972, ack 1, win 501, options [nop,nop,TS val 4229786164 ecr 1279667072], length 36
21:12:35.746623 IP lamponubuntu2204-s-1vcpu-1gb-tor1-01.ssh > pool-99-252-115-234.cpe.net.cable.rogers.com.42082: Flags [P.], seq 24972:25232, ack 1, win 501, options [nop,nop,TS val 4229786164 ecr 1279667072], length 260
21:12:35.746661 IP lamponubuntu2204-s-1vcpu-1gb-tor1-01.ssh > pool-99-252-115-234.cpe.net.cable.rogers.com.42082: Flags [P.], seq 25232:25268, ack 1, win 501, options [nop,nop,TS val 4229786164 ecr 1279667072], length 36
21:12:35.746713 IP lamponubuntu2204-s-1vcpu-1gb-tor1-01.ssh > pool-99-252-115-234.cpe.net.cable.rogers.com.42082: Flags [P.], seq 25268:25528, ack 1, win 501, options [nop,nop,TS val 4229786164 ecr 1279667072], length 260
21:12:35.746741 IP lamponubuntu2204-s-1vcpu-1gb-tor1-01.ssh > pool-99-252-115-234.cpe.net.cable.rogers.com.42082: Flags [P.], seq 25528:25564, ack 1, win 501, options [nop,nop,TS val 4229786164 ecr 1279667072], length 36
21:12:35.746779 IP lamponubuntu2204-s-1vcpu-1gb-tor1-01.ssh > pool-99-252-115-234.cpe.net.cable.rogers.com.42082: Flags [P.], seq 25564:25824, ack 1, win 501, options [nop,nop,TS val 4229786164 ecr 1279667072], length 260
21:12:35.746808 IP lamponubuntu2204-s-1vcpu-1gb-tor1-01.ssh > pool-99-252-115-234.cpe.net.cable.rogers.com.42082: Flags [P.], seq 25824:25860, ack 1, win 501, options [nop,nop,TS val 4229786164 ecr 1279667072], length 36
21:12:35.746846 IP lamponubuntu2204-s-1vcpu-1gb-tor1-01.ssh > pool-99-252-115-234.cpe.net.cable.rogers.com.42082: Flags [P.], seq 25860:26120, ack 1, win 501, options [nop,nop,TS val 4229786164 ecr 1279667072], length 260
21:12:35.746873 IP lamponubuntu2204-s-1vcpu-1gb-tor1-01.ssh > pool-99-252-115-234.cpe.net.cable.rogers.com.42082: Flags [P.], seq 26120:26156, ack 1, win 501, options [nop,nop,TS val 4229786164 ecr 1279667072], length 36
21:12:35.746909 IP lamponubuntu2204-s-1vcpu-1gb-tor1-01.ssh > pool-99-252-115-234.cpe.net.cable.rogers.com.42082: Flags [P.], seq 26156:26416, ack 1, win 501, options [nop,nop,TS val 4229786164 ecr 1279667072], length 260
21:12:35.746937 IP lamponubuntu2204-s-1vcpu-1gb-tor1-01.ssh > pool-99-252-115-234.cpe.net.cable.rogers.com.42082: Flags [P.], seq 26416:26452, ack 1, win 501, options [nop,nop,TS val 4229786164 ecr 1279667072], length 36
21:12:35.746975 IP lamponubuntu2204-s-1vcpu-1gb-tor1-01.ssh > pool-99-252-115-234.cpe.net.cable.rogers.com.42082: Flags [P.], seq 26452:26712, ack 1, win 501, options [nop,nop,TS val 4229786164 ecr 1279667072], length 260
21:12:35.747001 IP lamponubuntu2204-s-1vcpu-1gb-tor1-01.ssh > pool-99-252-115-234.cpe.net.cable.rogers.com.42082: Flags [P.], seq 26712:26748, ack 1, win 501, options [nop,nop,TS val 4229786164 ecr 1279667072], length 36
21:12:35.747038 IP lamponubuntu2204-s-1vcpu-1gb-tor1-01.ssh > pool-99-252-115-234.cpe.net.cable.rogers.com.42082: Flags [P.], seq 26748:27008, ack 1, win 501, options [nop,nop,TS val 4229786164 ecr 1279667072], length 260
21:12:35.747086 IP lamponubuntu2204-s-1vcpu-1gb-tor1-01.ssh > pool-99-252-115-234.cpe.net.cable.rogers.com.42082: Flags [P.], seq 27008:27044, ack 1, win 501, options [nop,nop,TS val 4229786164 ecr 1279667072], length 36
21:12:35.747105 IP lamponubuntu2204-s-1vcpu-1gb-tor1-01.ssh > pool-99-252-115-234.cpe.net.cable.rogers.com.42082: Flags [P.], seq 27044:27304, ack 1, win 501, options [nop,nop,TS val 4229786164 ecr 1279667072], length 260
21:12:35.747130 IP lamponubuntu2204-s-1vcpu-1gb-tor1-01.ssh > pool-99-252-115-234.cpe.net.cable.rogers.com.42082: Flags [P.], seq 27304:27340, ack 1, win 501, options [nop,nop,TS val 4229786164 ecr 1279667072], length 36
21:12:35.747166 IP lamponubuntu2204-s-1vcpu-1gb-tor1-01.ssh > pool-99-252-115-234.cpe.net.cable.rogers.com.42082: Flags [P.], seq 27340:27600, ack 1, win 501, options [nop,nop,TS val 4229786165 ecr 1279667072], length 260
21:12:35.747192 IP lamponubuntu2204-s-1vcpu-1gb-tor1-01.ssh > pool-99-252-115-234.cpe.net.cable.rogers.com.42082: Flags [P.], seq 27600:27636, ack 1, win 501, options [nop,nop,TS val 4229786165 ecr 1279667072], length 36
21:12:35.747229 IP lamponubuntu2204-s-1vcpu-1gb-tor1-01.ssh > pool-99-252-115-234.cpe.net.cable.rogers.com.42082: Flags [P.], seq 27636:27896, ack 1, win 501, options [nop,nop,TS val 4229786165 ecr 1279667072], length 260
21:12:35.747255 IP lamponubuntu2204-s-1vcpu-1gb-tor1-01.ssh > pool-99-252-115-234.cpe.net.cable.rogers.com.42082: Flags [P.], seq 27896:27932, ack 1, win 501, options [nop,nop,TS val 4229786165 ecr 1279667072], length 36
21:12:35.747292 IP lamponubuntu2204-s-1vcpu-1gb-tor1-01.ssh > pool-99-252-115-234.cpe.net.cable.rogers.com.42082: Flags [P.], seq 27932:28192, ack 1, win 501, options [nop,nop,TS val 4229786165 ecr 1279667072], length 260
21:12:35.747318 IP lamponubuntu2204-s-1vcpu-1gb-tor1-01.ssh > pool-99-252-115-234.cpe.net.cable.rogers.com.42082: Flags [P.], seq 28192:28228, ack 1, win 501, options [nop,nop,TS val 4229786165 ecr 1279667072], length 36
21:12:35.747355 IP lamponubuntu2204-s-1vcpu-1gb-tor1-01.ssh > pool-99-252-115-234.cpe.net.cable.rogers.com.42082: Flags [P.], seq 28228:28488, ack 1, win 501, options [nop,nop,TS val 4229786165 ecr 1279667072], length 260
21:12:35.747390 IP lamponubuntu2204-s-1vcpu-1gb-tor1-01.ssh > pool-99-252-115-234.cpe.net.cable.rogers.com.42082: Flags [P.], seq 28488:28524, ack 1, win 501, options [nop,nop,TS val 4229786165 ecr 1279667072], length 36
21:12:35.747449 IP lamponubuntu2204-s-1vcpu-1gb-tor1-01.ssh > pool-99-252-115-234.cpe.net.cable.rogers.com.42082: Flags [P.], seq 28524:28784, ack 1, win 501, options [nop,nop,TS val 4229786165 ecr 1279667072], length 260
21:12:35.747487 IP lamponubuntu2204-s-1vcpu-1gb-tor1-01.ssh > pool-99-252-115-234.cpe.net.cable.rogers.com.42082: Flags [P.], seq 28784:28820, ack 1, win 501, options [nop,nop,TS val 4229786165 ecr 1279667072], length 36
21:12:35.747540 IP lamponubuntu2204-s-1vcpu-1gb-tor1-01.ssh > pool-99-252-115-234.cpe.net.cable.rogers.com.42082: Flags [P.], seq 28820:29080, ack 1, win 501, options [nop,nop,TS val 4229786165 ecr 1279667072], length 260
21:12:35.747673 IP lamponubuntu2204-s-1vcpu-1gb-tor1-01.ssh > pool-99-252-115-234.cpe.net.cable.rogers.com.42082: Flags [P.], seq 29080:29708, ack 1, win 501, options [nop,nop,TS val 4229786165 ecr 1279667072], length 628
21:12:35.747749 IP lamponubuntu2204-s-1vcpu-1gb-tor1-01.ssh > pool-99-252-115-234.cpe.net.cable.rogers.com.42082: Flags [P.], seq 29708:29968, ack 1, win 501, options [nop,nop,TS val 4229786165 ecr 1279667072], length 260
21:12:35.747783 IP lamponubuntu2204-s-1vcpu-1gb-tor1-01.ssh > pool-99-252-115-234.cpe.net.cable.rogers.com.42082: Flags [P.], seq 29968:30004, ack 1, win 501, options [nop,nop,TS val 4229786165 ecr 1279667072], length 36
21:12:35.747836 IP lamponubuntu2204-s-1vcpu-1gb-tor1-01.ssh > pool-99-252-115-234.cpe.net.cable.rogers.com.42082: Flags [P.], seq 30004:30264, ack 1, win 501, options [nop,nop,TS val 4229786165 ecr 1279667072], length 260
21:12:35.747890 IP lamponubuntu2204-s-1vcpu-1gb-tor1-01.ssh > pool-99-252-115-234.cpe.net.cable.rogers.com.42082: Flags [P.], seq 30264:30560, ack 1, win 501, options [nop,nop,TS val 4229786165 ecr 1279667072], length 296
21:12:35.748018 IP lamponubuntu2204-s-1vcpu-1gb-tor1-01.ssh > pool-99-252-115-234.cpe.net.cable.rogers.com.42082: Flags [P.], seq 30560:31484, ack 1, win 501, options [nop,nop,TS val 4229786165 ecr 1279667072], length 924
21:12:35.748055 IP lamponubuntu2204-s-1vcpu-1gb-tor1-01.ssh > pool-99-252-115-234.cpe.net.cable.rogers.com.42082: Flags [P.], seq 31484:31744, ack 1, win 501, options [nop,nop,TS val 4229786165 ecr 1279667072], length 260
21:12:35.748081 IP lamponubuntu2204-s-1vcpu-1gb-tor1-01.ssh > pool-99-252-115-234.cpe.net.cable.rogers.com.42082: Flags [P.], seq 31744:31780, ack 1, win 501, options [nop,nop,TS val 4229786165 ecr 1279667072], length 36
21:12:35.748119 IP lamponubuntu2204-s-1vcpu-1gb-tor1-01.ssh > pool-99-252-115-234.cpe.net.cable.rogers.com.42082: Flags [P.], seq 31780:32040, ack 1, win 501, options [nop,nop,TS val 4229786165 ecr 1279667072], length 260
21:12:35.748170 IP lamponubuntu2204-s-1vcpu-1gb-tor1-01.ssh > pool-99-252-115-234.cpe.net.cable.rogers.com.42082: Flags [P.], seq 32040:32336, ack 1, win 501, options [nop,nop,TS val 4229786166 ecr 1279667072], length 296
21:12:35.748196 IP lamponubuntu2204-s-1vcpu-1gb-tor1-01.ssh > pool-99-252-115-234.cpe.net.cable.rogers.com.42082: Flags [P.], seq 32336:32372, ack 1, win 501, options [nop,nop,TS val 4229786166 ecr 1279667072], length 36
21:12:35.748236 IP lamponubuntu2204-s-1vcpu-1gb-tor1-01.ssh > pool-99-252-115-234.cpe.net.cable.rogers.com.42082: Flags [P.], seq 32372:32632, ack 1, win 501, options [nop,nop,TS val 4229786166 ecr 1279667072], length 260
21:12:35.748262 IP lamponubuntu2204-s-1vcpu-1gb-tor1-01.ssh > pool-99-252-115-234.cpe.net.cable.rogers.com.42082: Flags [P.], seq 32632:32668, ack 1, win 501, options [nop,nop,TS val 4229786166 ecr 1279667072], length 36
21:12:35.748299 IP lamponubuntu2204-s-1vcpu-1gb-tor1-01.ssh > pool-99-252-115-234.cpe.net.cable.rogers.com.42082: Flags [P.], seq 32668:32928, ack 1, win 501, options [nop,nop,TS val 4229786166 ecr 1279667072], length 260
21:12:35.748324 IP lamponubuntu2204-s-1vcpu-1gb-tor1-01.ssh > pool-99-252-115-234.cpe.net.cable.rogers.com.42082: Flags [P.], seq 32928:32964, ack 1, win 501, options [nop,nop,TS val 4229786166 ecr 1279667072], length 36
21:12:35.748360 IP lamponubuntu2204-s-1vcpu-1gb-tor1-01.ssh > pool-99-252-115-234.cpe.net.cable.rogers.com.42082: Flags [P.], seq 32964:33224, ack 1, win 501, options [nop,nop,TS val 4229786166 ecr 1279667072], length 260
21:12:35.748385 IP lamponubuntu2204-s-1vcpu-1gb-tor1-01.ssh > pool-99-252-115-234.cpe.net.cable.rogers.com.42082: Flags [P.], seq 33224:33260, ack 1, win 501, options [nop,nop,TS val 4229786166 ecr 1279667072], length 36
21:12:35.748421 IP lamponubuntu2204-s-1vcpu-1gb-tor1-01.ssh > pool-99-252-115-234.cpe.net.cable.rogers.com.42082: Flags [P.], seq 33260:33520, ack 1, win 501, options [nop,nop,TS val 4229786166 ecr 1279667072], length 260
21:12:35.748447 IP lamponubuntu2204-s-1vcpu-1gb-tor1-01.ssh > pool-99-252-115-234.cpe.net.cable.rogers.com.42082: Flags [P.], seq 33520:33556, ack 1, win 501, options [nop,nop,TS val 4229786166 ecr 1279667072], length 36
21:12:35.748486 IP lamponubuntu2204-s-1vcpu-1gb-tor1-01.ssh > pool-99-252-115-234.cpe.net.cable.rogers.com.42082: Flags [P.], seq 33556:33816, ack 1, win 501, options [nop,nop,TS val 4229786166 ecr 1279667072], length 260
21:12:35.748512 IP lamponubuntu2204-s-1vcpu-1gb-tor1-01.ssh > pool-99-252-115-234.cpe.net.cable.rogers.com.42082: Flags [P.], seq 33816:33852, ack 1, win 501, options [nop,nop,TS val 4229786166 ecr 1279667072], length 36
21:12:35.748548 IP lamponubuntu2204-s-1vcpu-1gb-tor1-01.ssh > pool-99-252-115-234.cpe.net.cable.rogers.com.42082: Flags [P.], seq 33852:34112, ack 1, win 501, options [nop,nop,TS val 4229786166 ecr 1279667072], length 260
21:12:35.748579 IP lamponubuntu2204-s-1vcpu-1gb-tor1-01.ssh > pool-99-252-115-234.cpe.net.cable.rogers.com.42082: Flags [P.], seq 34112:34148, ack 1, win 501, options [nop,nop,TS val 4229786166 ecr 1279667072], length 36
21:12:35.748624 IP lamponubuntu2204-s-1vcpu-1gb-tor1-01.ssh > pool-99-252-115-234.cpe.net.cable.rogers.com.42082: Flags [P.], seq 34148:34408, ack 1, win 501, options [nop,nop,TS val 4229786166 ecr 1279667072], length 260
21:12:35.748650 IP lamponubuntu2204-s-1vcpu-1gb-tor1-01.ssh > pool-99-252-115-234.cpe.net.cable.rogers.com.42082: Flags [P.], seq 34408:34444, ack 1, win 501, options [nop,nop,TS val 4229786166 ecr 1279667072], length 36
21:12:35.748690 IP lamponubuntu2204-s-1vcpu-1gb-tor1-01.ssh > pool-99-252-115-234.cpe.net.cable.rogers.com.42082: Flags [P.], seq 34444:34704, ack 1, win 501, options [nop,nop,TS val 4229786166 ecr 1279667072], length 260
21:12:35.748716 IP lamponubuntu2204-s-1vcpu-1gb-tor1-01.ssh > pool-99-252-115-234.cpe.net.cable.rogers.com.42082: Flags [P.], seq 34704:34740, ack 1, win 501, options [nop,nop,TS val 4229786166 ecr 1279667072], length 36
21:12:35.748755 IP lamponubuntu2204-s-1vcpu-1gb-tor1-01.ssh > pool-99-252-115-234.cpe.net.cable.rogers.com.42082: Flags [P.], seq 34740:35000, ack 1, win 501, options [nop,nop,TS val 4229786166 ecr 1279667072], length 260
21:12:35.748782 IP lamponubuntu2204-s-1vcpu-1gb-tor1-01.ssh > pool-99-252-115-234.cpe.net.cable.rogers.com.42082: Flags [P.], seq 35000:35036, ack 1, win 501, options [nop,nop,TS val 4229786166 ecr 1279667072], length 36
21:12:35.748831 IP lamponubuntu2204-s-1vcpu-1gb-tor1-01.ssh > pool-99-252-115-234.cpe.net.cable.rogers.com.42082: Flags [P.], seq 35036:35296, ack 1, win 501, options [nop,nop,TS val 4229786166 ecr 1279667072], length 260
21:12:35.748857 IP lamponubuntu2204-s-1vcpu-1gb-tor1-01.ssh > pool-99-252-115-234.cpe.net.cable.rogers.com.42082: Flags [P.], seq 35296:35332, ack 1, win 501, options [nop,nop,TS val 4229786166 ecr 1279667072], length 36
21:12:35.748893 IP lamponubuntu2204-s-1vcpu-1gb-tor1-01.ssh > pool-99-252-115-234.cpe.net.cable.rogers.com.42082: Flags [P.], seq 35332:35592, ack 1, win 501, options [nop,nop,TS val 4229786166 ecr 1279667072], length 260
21:12:35.748919 IP lamponubuntu2204-s-1vcpu-1gb-tor1-01.ssh > pool-99-252-115-234.cpe.net.cable.rogers.com.42082: Flags [P.], seq 35592:35628, ack 1, win 501, options [nop,nop,TS val 4229786166 ecr 1279667072], length 36
21:12:35.748955 IP lamponubuntu2204-s-1vcpu-1gb-tor1-01.ssh > pool-99-252-115-234.cpe.net.cable.rogers.com.42082: Flags [P.], seq 35628:35888, ack 1, win 501, options [nop,nop,TS val 4229786166 ecr 1279667072], length 260
21:12:35.748981 IP lamponubuntu2204-s-1vcpu-1gb-tor1-01.ssh > pool-99-252-115-234.cpe.net.cable.rogers.com.42082: Flags [P.], seq 35888:35924, ack 1, win 501, options [nop,nop,TS val 4229786166 ecr 1279667072], length 36
21:12:35.749020 IP lamponubuntu2204-s-1vcpu-1gb-tor1-01.ssh > pool-99-252-115-234.cpe.net.cable.rogers.com.42082: Flags [P.], seq 35924:36184, ack 1, win 501, options [nop,nop,TS val 4229786166 ecr 1279667072], length 260
21:12:35.749047 IP lamponubuntu2204-s-1vcpu-1gb-tor1-01.ssh > pool-99-252-115-234.cpe.net.cable.rogers.com.42082: Flags [P.], seq 36184:36220, ack 1, win 501, options [nop,nop,TS val 4229786166 ecr 1279667072], length 36
21:12:35.749083 IP lamponubuntu2204-s-1vcpu-1gb-tor1-01.ssh > pool-99-252-115-234.cpe.net.cable.rogers.com.42082: Flags [P.], seq 36220:36480, ack 1, win 501, options [nop,nop,TS val 4229786166 ecr 1279667072], length 260
21:12:35.749109 IP lamponubuntu2204-s-1vcpu-1gb-tor1-01.ssh > pool-99-252-115-234.cpe.net.cable.rogers.com.42082: Flags [P.], seq 36480:36516, ack 1, win 501, options [nop,nop,TS val 4229786166 ecr 1279667072], length 36
21:12:35.749144 IP lamponubuntu2204-s-1vcpu-1gb-tor1-01.ssh > pool-99-252-115-234.cpe.net.cable.rogers.com.42082: Flags [P.], seq 36516:36776, ack 1, win 501, options [nop,nop,TS val 4229786166 ecr 1279667072], length 260
21:12:35.749197 IP lamponubuntu2204-s-1vcpu-1gb-tor1-01.ssh > pool-99-252-115-234.cpe.net.cable.rogers.com.42082: Flags [P.], seq 36776:37072, ack 1, win 501, options [nop,nop,TS val 4229786167 ecr 1279667072], length 296
21:12:35.749224 IP lamponubuntu2204-s-1vcpu-1gb-tor1-01.ssh > pool-99-252-115-234.cpe.net.cable.rogers.com.42082: Flags [P.], seq 37072:37108, ack 1, win 501, options [nop,nop,TS val 4229786167 ecr 1279667072], length 36
21:12:35.749351 IP lamponubuntu2204-s-1vcpu-1gb-tor1-01.ssh > pool-99-252-115-234.cpe.net.cable.rogers.com.42082: Flags [P.], seq 37108:37368, ack 1, win 501, options [nop,nop,TS val 4229786167 ecr 1279667072], length 260
21:12:35.749383 IP lamponubuntu2204-s-1vcpu-1gb-tor1-01.ssh > pool-99-252-115-234.cpe.net.cable.rogers.com.42082: Flags [P.], seq 37368:37404, ack 1, win 501, options [nop,nop,TS val 4229786167 ecr 1279667072], length 36
21:12:35.749429 IP lamponubuntu2204-s-1vcpu-1gb-tor1-01.ssh > pool-99-252-115-234.cpe.net.cable.rogers.com.42082: Flags [P.], seq 37404:37664, ack 1, win 501, options [nop,nop,TS val 4229786167 ecr 1279667072], length 260
21:12:35.749456 IP lamponubuntu2204-s-1vcpu-1gb-tor1-01.ssh > pool-99-252-115-234.cpe.net.cable.rogers.com.42082: Flags [P.], seq 37664:37700, ack 1, win 501, options [nop,nop,TS val 4229786167 ecr 1279667072], length 36
21:12:35.749492 IP lamponubuntu2204-s-1vcpu-1gb-tor1-01.ssh > pool-99-252-115-234.cpe.net.cable.rogers.com.42082: Flags [P.], seq 37700:37960, ack 1, win 501, options [nop,nop,TS val 4229786167 ecr 1279667072], length 260
21:12:35.749537 IP lamponubuntu2204-s-1vcpu-1gb-tor1-01.ssh > pool-99-252-115-234.cpe.net.cable.rogers.com.42082: Flags [P.], seq 37960:37996, ack 1, win 501, options [nop,nop,TS val 4229786167 ecr 1279667072], length 36
21:12:35.749563 IP lamponubuntu2204-s-1vcpu-1gb-tor1-01.ssh > pool-99-252-115-234.cpe.net.cable.rogers.com.42082: Flags [P.], seq 37996:38256, ack 1, win 501, options [nop,nop,TS val 4229786167 ecr 1279667072], length 260
21:12:35.749596 IP lamponubuntu2204-s-1vcpu-1gb-tor1-01.ssh > pool-99-252-115-234.cpe.net.cable.rogers.com.42082: Flags [P.], seq 38256:38292, ack 1, win 501, options [nop,nop,TS val 4229786167 ecr 1279667072], length 36
21:12:35.749653 IP lamponubuntu2204-s-1vcpu-1gb-tor1-01.ssh > pool-99-252-115-234.cpe.net.cable.rogers.com.42082: Flags [P.], seq 38292:38552, ack 1, win 501, options [nop,nop,TS val 4229786167 ecr 1279667072], length 260
21:12:35.749698 IP lamponubuntu2204-s-1vcpu-1gb-tor1-01.ssh > pool-99-252-115-234.cpe.net.cable.rogers.com.42082: Flags [P.], seq 38552:38588, ack 1, win 501, options [nop,nop,TS val 4229786167 ecr 1279667072], length 36
21:12:35.749748 IP lamponubuntu2204-s-1vcpu-1gb-tor1-01.ssh > pool-99-252-115-234.cpe.net.cable.rogers.com.42082: Flags [P.], seq 38588:38848, ack 1, win 501, options [nop,nop,TS val 4229786167 ecr 1279667072], length 260
21:12:35.749775 IP lamponubuntu2204-s-1vcpu-1gb-tor1-01.ssh > pool-99-252-115-234.cpe.net.cable.rogers.com.42082: Flags [P.], seq 38848:38884, ack 1, win 501, options [nop,nop,TS val 4229786167 ecr 1279667072], length 36
21:12:35.749811 IP lamponubuntu2204-s-1vcpu-1gb-tor1-01.ssh > pool-99-252-115-234.cpe.net.cable.rogers.com.42082: Flags [P.], seq 38884:39144, ack 1, win 501, options [nop,nop,TS val 4229786167 ecr 1279667072], length 260
21:12:35.749837 IP lamponubuntu2204-s-1vcpu-1gb-tor1-01.ssh > pool-99-252-115-234.cpe.net.cable.rogers.com.42082: Flags [P.], seq 39144:39180, ack 1, win 501, options [nop,nop,TS val 4229786167 ecr 1279667072], length 36
21:12:35.749874 IP lamponubuntu2204-s-1vcpu-1gb-tor1-01.ssh > pool-99-252-115-234.cpe.net.cable.rogers.com.42082: Flags [P.], seq 39180:39440, ack 1, win 501, options [nop,nop,TS val 4229786167 ecr 1279667072], length 260
21:12:35.749899 IP lamponubuntu2204-s-1vcpu-1gb-tor1-01.ssh > pool-99-252-115-234.cpe.net.cable.rogers.com.42082: Flags [P.], seq 39440:39476, ack 1, win 501, options [nop,nop,TS val 4229786167 ecr 1279667072], length 36
21:12:35.749935 IP lamponubuntu2204-s-1vcpu-1gb-tor1-01.ssh > pool-99-252-115-234.cpe.net.cable.rogers.com.42082: Flags [P.], seq 39476:39736, ack 1, win 501, options [nop,nop,TS val 4229786167 ecr 1279667072], length 260
21:12:35.749963 IP lamponubuntu2204-s-1vcpu-1gb-tor1-01.ssh > pool-99-252-115-234.cpe.net.cable.rogers.com.42082: Flags [P.], seq 39736:39772, ack 1, win 501, options [nop,nop,TS val 4229786167 ecr 1279667072], length 36
21:12:35.749999 IP lamponubuntu2204-s-1vcpu-1gb-tor1-01.ssh > pool-99-252-115-234.cpe.net.cable.rogers.com.42082: Flags [P.], seq 39772:40032, ack 1, win 501, options [nop,nop,TS val 4229786167 ecr 1279667072], length 260
21:12:35.750025 IP lamponubuntu2204-s-1vcpu-1gb-tor1-01.ssh > pool-99-252-115-234.cpe.net.cable.rogers.com.42082: Flags [P.], seq 40032:40068, ack 1, win 501, options [nop,nop,TS val 4229786167 ecr 1279667072], length 36
21:12:35.750061 IP lamponubuntu2204-s-1vcpu-1gb-tor1-01.ssh > pool-99-252-115-234.cpe.net.cable.rogers.com.42082: Flags [P.], seq 40068:40328, ack 1, win 501, options [nop,nop,TS val 4229786167 ecr 1279667072], length 260
21:12:35.750086 IP lamponubuntu2204-s-1vcpu-1gb-tor1-01.ssh > pool-99-252-115-234.cpe.net.cable.rogers.com.42082: Flags [P.], seq 40328:40364, ack 1, win 501, options [nop,nop,TS val 4229786167 ecr 1279667072], length 36
21:12:35.761520 IP pool-99-252-115-234.cpe.net.cable.rogers.com.42082 > lamponubuntu2204-s-1vcpu-1gb-tor1-01.ssh: Flags [.], ack 30004, win 1623, options [nop,nop,TS val 1279667154 ecr 4229786165], length 0
21:12:35.761521 IP pool-99-252-115-234.cpe.net.cable.rogers.com.42082 > lamponubuntu2204-s-1vcpu-1gb-tor1-01.ssh: Flags [.], ack 38292, win 1610, options [nop,nop,TS val 1279667157 ecr 4229786166], length 0
21:12:35.761615 IP lamponubuntu2204-s-1vcpu-1gb-tor1-01.ssh > pool-99-252-115-234.cpe.net.cable.rogers.com.42082: Flags [P.], seq 40364:45848, ack 1, win 501, options [nop,nop,TS val 4229786179 ecr 1279667154], length 5484
21:12:35.768039 IP pool-99-252-115-234.cpe.net.cable.rogers.com.42082 > lamponubuntu2204-s-1vcpu-1gb-tor1-01.ssh: Flags [.], ack 40364, win 1623, options [nop,nop,TS val 1279667157 ecr 4229786167], length 0
21:12:35.785407 IP pool-99-252-115-234.cpe.net.cable.rogers.com.42082 > lamponubuntu2204-s-1vcpu-1gb-tor1-01.ssh: Flags [.], ack 45848, win 1623, options [nop,nop,TS val 1279667169 ecr 4229786179], length 0
21:12:35.791887 IP pool-99-252-115-234.cpe.net.cable.rogers.com.42082 > lamponubuntu2204-s-1vcpu-1gb-tor1-01.ssh: Flags [P.], seq 1:37, ack 45848, win 1623, options [nop,nop,TS val 1279667170 ecr 4229786179], length 36
21:12:35.834242 IP lamponubuntu2204-s-1vcpu-1gb-tor1-01.ssh > pool-99-252-115-234.cpe.net.cable.rogers.com.42082: Flags [.], ack 37, win 501, options [nop,nop,TS val 4229786252 ecr 1279667170], length 0
21:12:35.850485 IP lamponubuntu2204-s-1vcpu-1gb-tor1-01.ssh > pool-99-252-115-234.cpe.net.cable.rogers.com.42082: Flags [P.], seq 45848:46108, ack 37, win 501, options [nop,nop,TS val 4229786268 ecr 1279667170], length 260
21:12:35.850729 IP lamponubuntu2204-s-1vcpu-1gb-tor1-01.ssh > pool-99-252-115-234.cpe.net.cable.rogers.com.42082: Flags [P.], seq 46108:47704, ack 37, win 501, options [nop,nop,TS val 4229786268 ecr 1279667170], length 1596
21:12:35.850863 IP lamponubuntu2204-s-1vcpu-1gb-tor1-01.ssh > pool-99-252-115-234.cpe.net.cable.rogers.com.42082: Flags [P.], seq 47704:48628, ack 37, win 501, options [nop,nop,TS val 4229786268 ecr 1279667170], length 924
21:12:35.850976 IP lamponubuntu2204-s-1vcpu-1gb-tor1-01.ssh > pool-99-252-115-234.cpe.net.cable.rogers.com.42082: Flags [P.], seq 48628:49336, ack 37, win 501, options [nop,nop,TS val 4229786268 ecr 1279667170], length 708
21:12:35.851078 IP lamponubuntu2204-s-1vcpu-1gb-tor1-01.ssh > pool-99-252-115-234.cpe.net.cable.rogers.com.42082: Flags [P.], seq 49336:50044, ack 37, win 501, options [nop,nop,TS val 4229786268 ecr 1279667170], length 708
21:12:35.851184 IP lamponubuntu2204-s-1vcpu-1gb-tor1-01.ssh > pool-99-252-115-234.cpe.net.cable.rogers.com.42082: Flags [P.], seq 50044:50752, ack 37, win 501, options [nop,nop,TS val 4229786269 ecr 1279667170], length 708
21:12:35.851290 IP lamponubuntu2204-s-1vcpu-1gb-tor1-01.ssh > pool-99-252-115-234.cpe.net.cable.rogers.com.42082: Flags [P.], seq 50752:51460, ack 37, win 501, options [nop,nop,TS val 4229786269 ecr 1279667170], length 708
21:12:35.851393 IP lamponubuntu2204-s-1vcpu-1gb-tor1-01.ssh > pool-99-252-115-234.cpe.net.cable.rogers.com.42082: Flags [P.], seq 51460:52168, ack 37, win 501, options [nop,nop,TS val 4229786269 ecr 1279667170], length 708
21:12:35.851478 IP lamponubuntu2204-s-1vcpu-1gb-tor1-01.ssh > pool-99-252-115-234.cpe.net.cable.rogers.com.42082: Flags [P.], seq 52168:52652, ack 37, win 501, options [nop,nop,TS val 4229786269 ecr 1279667170], length 484
21:12:35.851583 IP lamponubuntu2204-s-1vcpu-1gb-tor1-01.ssh > pool-99-252-115-234.cpe.net.cable.rogers.com.42082: Flags [P.], seq 52652:53360, ack 37, win 501, options [nop,nop,TS val 4229786269 ecr 1279667170], length 708
21:12:35.851669 IP lamponubuntu2204-s-1vcpu-1gb-tor1-01.ssh > pool-99-252-115-234.cpe.net.cable.rogers.com.42082: Flags [P.], seq 53360:53844, ack 37, win 501, options [nop,nop,TS val 4229786269 ecr 1279667170], length 484
21:12:35.851778 IP lamponubuntu2204-s-1vcpu-1gb-tor1-01.ssh > pool-99-252-115-234.cpe.net.cable.rogers.com.42082: Flags [P.], seq 53844:54552, ack 37, win 501, options [nop,nop,TS val 4229786269 ecr 1279667170], length 708
21:12:35.851859 IP lamponubuntu2204-s-1vcpu-1gb-tor1-01.ssh > pool-99-252-115-234.cpe.net.cable.rogers.com.42082: Flags [P.], seq 54552:55036, ack 37, win 501, options [nop,nop,TS val 4229786269 ecr 1279667170], length 484
21:12:35.851944 IP lamponubuntu2204-s-1vcpu-1gb-tor1-01.ssh > pool-99-252-115-234.cpe.net.cable.rogers.com.42082: Flags [P.], seq 55036:55520, ack 37, win 501, options [nop,nop,TS val 4229786269 ecr 1279667170], length 484
21:12:35.852029 IP lamponubuntu2204-s-1vcpu-1gb-tor1-01.ssh > pool-99-252-115-234.cpe.net.cable.rogers.com.42082: Flags [P.], seq 55520:56004, ack 37, win 501, options [nop,nop,TS val 4229786269 ecr 1279667170], length 484
21:12:35.852129 IP lamponubuntu2204-s-1vcpu-1gb-tor1-01.ssh > pool-99-252-115-234.cpe.net.cable.rogers.com.42082: Flags [P.], seq 56004:56712, ack 37, win 501, options [nop,nop,TS val 4229786269 ecr 1279667170], length 708
21:12:35.852215 IP lamponubuntu2204-s-1vcpu-1gb-tor1-01.ssh > pool-99-252-115-234.cpe.net.cable.rogers.com.42082: Flags [P.], seq 56712:57196, ack 37, win 501, options [nop,nop,TS val 4229786270 ecr 1279667170], length 484
21:12:35.852295 IP lamponubuntu2204-s-1vcpu-1gb-tor1-01.ssh > pool-99-252-115-234.cpe.net.cable.rogers.com.42082: Flags [P.], seq 57196:57680, ack 37, win 501, options [nop,nop,TS val 4229786270 ecr 1279667170], length 484
21:12:35.852392 IP lamponubuntu2204-s-1vcpu-1gb-tor1-01.ssh > pool-99-252-115-234.cpe.net.cable.rogers.com.42082: Flags [P.], seq 57680:58388, ack 37, win 501, options [nop,nop,TS val 4229786270 ecr 1279667170], length 708
21:12:35.852476 IP lamponubuntu2204-s-1vcpu-1gb-tor1-01.ssh > pool-99-252-115-234.cpe.net.cable.rogers.com.42082: Flags [P.], seq 58388:58872, ack 37, win 501, options [nop,nop,TS val 4229786270 ecr 1279667170], length 484
21:12:35.852558 IP lamponubuntu2204-s-1vcpu-1gb-tor1-01.ssh > pool-99-252-115-234.cpe.net.cable.rogers.com.42082: Flags [P.], seq 58872:59356, ack 37, win 501, options [nop,nop,TS val 4229786270 ecr 1279667170], length 484
21:12:35.852645 IP lamponubuntu2204-s-1vcpu-1gb-tor1-01.ssh > pool-99-252-115-234.cpe.net.cable.rogers.com.42082: Flags [P.], seq 59356:59616, ack 37, win 501, options [nop,nop,TS val 4229786270 ecr 1279667170], length 260
21:12:35.852727 IP lamponubuntu2204-s-1vcpu-1gb-tor1-01.ssh > pool-99-252-115-234.cpe.net.cable.rogers.com.42082: Flags [P.], seq 59616:60100, ack 37, win 501, options [nop,nop,TS val 4229786270 ecr 1279667170], length 484
21:12:35.852863 IP lamponubuntu2204-s-1vcpu-1gb-tor1-01.ssh > pool-99-252-115-234.cpe.net.cable.rogers.com.42082: Flags [P.], seq 60100:60360, ack 37, win 501, options [nop,nop,TS val 4229786270 ecr 1279667170], length 260
21:12:35.852973 IP lamponubuntu2204-s-1vcpu-1gb-tor1-01.ssh > pool-99-252-115-234.cpe.net.cable.rogers.com.42082: Flags [P.], seq 60360:61068, ack 37, win 501, options [nop,nop,TS val 4229786270 ecr 1279667170], length 708
21:12:35.853081 IP lamponubuntu2204-s-1vcpu-1gb-tor1-01.ssh > pool-99-252-115-234.cpe.net.cable.rogers.com.42082: Flags [P.], seq 61068:61776, ack 37, win 501, options [nop,nop,TS val 4229786270 ecr 1279667170], length 708
21:12:35.853187 IP lamponubuntu2204-s-1vcpu-1gb-tor1-01.ssh > pool-99-252-115-234.cpe.net.cable.rogers.com.42082: Flags [P.], seq 61776:62484, ack 37, win 501, options [nop,nop,TS val 4229786271 ecr 1279667170], length 708
21:12:35.853416 IP lamponubuntu2204-s-1vcpu-1gb-tor1-01.ssh > pool-99-252-115-234.cpe.net.cable.rogers.com.42082: Flags [P.], seq 62484:62968, ack 37, win 501, options [nop,nop,TS val 4229786271 ecr 1279667170], length 484
21:12:35.853465 IP lamponubuntu2204-s-1vcpu-1gb-tor1-01.ssh > pool-99-252-115-234.cpe.net.cable.rogers.com.42082: Flags [P.], seq 62968:63004, ack 37, win 501, options [nop,nop,TS val 4229786271 ecr 1279667170], length 36
21:12:35.853527 IP lamponubuntu2204-s-1vcpu-1gb-tor1-01.ssh > pool-99-252-115-234.cpe.net.cable.rogers.com.42082: Flags [P.], seq 63004:63264, ack 37, win 501, options [nop,nop,TS val 4229786271 ecr 1279667170], length 260
21:12:35.853568 IP lamponubuntu2204-s-1vcpu-1gb-tor1-01.ssh > pool-99-252-115-234.cpe.net.cable.rogers.com.42082: Flags [P.], seq 63264:63300, ack 37, win 501, options [nop,nop,TS val 4229786271 ecr 1279667170], length 36
21:12:35.853626 IP lamponubuntu2204-s-1vcpu-1gb-tor1-01.ssh > pool-99-252-115-234.cpe.net.cable.rogers.com.42082: Flags [P.], seq 63300:63560, ack 37, win 501, options [nop,nop,TS val 4229786271 ecr 1279667170], length 260
21:12:35.853689 IP lamponubuntu2204-s-1vcpu-1gb-tor1-01.ssh > pool-99-252-115-234.cpe.net.cable.rogers.com.42082: Flags [P.], seq 63560:63820, ack 37, win 501, options [nop,nop,TS val 4229786271 ecr 1279667170], length 260
21:12:35.853776 IP lamponubuntu2204-s-1vcpu-1gb-tor1-01.ssh > pool-99-252-115-234.cpe.net.cable.rogers.com.42082: Flags [P.], seq 63820:64304, ack 37, win 501, options [nop,nop,TS val 4229786271 ecr 1279667170], length 484
21:12:35.853860 IP lamponubuntu2204-s-1vcpu-1gb-tor1-01.ssh > pool-99-252-115-234.cpe.net.cable.rogers.com.42082: Flags [P.], seq 64304:64788, ack 37, win 501, options [nop,nop,TS val 4229786271 ecr 1279667170], length 484
21:12:35.853943 IP lamponubuntu2204-s-1vcpu-1gb-tor1-01.ssh > pool-99-252-115-234.cpe.net.cable.rogers.com.42082: Flags [P.], seq 64788:65272, ack 37, win 501, options [nop,nop,TS val 4229786271 ecr 1279667170], length 484
21:12:35.854042 IP lamponubuntu2204-s-1vcpu-1gb-tor1-01.ssh > pool-99-252-115-234.cpe.net.cable.rogers.com.42082: Flags [P.], seq 65272:65980, ack 37, win 501, options [nop,nop,TS val 4229786271 ecr 1279667170], length 708
21:12:35.854184 IP lamponubuntu2204-s-1vcpu-1gb-tor1-01.ssh > pool-99-252-115-234.cpe.net.cable.rogers.com.42082: Flags [P.], seq 65980:66688, ack 37, win 501, options [nop,nop,TS val 4229786271 ecr 1279667170], length 708
21:12:35.854311 IP lamponubuntu2204-s-1vcpu-1gb-tor1-01.ssh > pool-99-252-115-234.cpe.net.cable.rogers.com.42082: Flags [P.], seq 66688:67620, ack 37, win 501, options [nop,nop,TS val 4229786272 ecr 1279667170], length 932
21:12:35.854434 IP lamponubuntu2204-s-1vcpu-1gb-tor1-01.ssh > pool-99-252-115-234.cpe.net.cable.rogers.com.42082: Flags [P.], seq 67620:68520, ack 37, win 501, options [nop,nop,TS val 4229786272 ecr 1279667170], length 900
21:12:35.854542 IP lamponubuntu2204-s-1vcpu-1gb-tor1-01.ssh > pool-99-252-115-234.cpe.net.cable.rogers.com.42082: Flags [P.], seq 68520:69196, ack 37, win 501, options [nop,nop,TS val 4229786272 ecr 1279667170], length 676
21:12:35.854631 IP lamponubuntu2204-s-1vcpu-1gb-tor1-01.ssh > pool-99-252-115-234.cpe.net.cable.rogers.com.42082: Flags [P.], seq 69196:69656, ack 37, win 501, options [nop,nop,TS val 4229786272 ecr 1279667170], length 460
21:12:35.854685 IP lamponubuntu2204-s-1vcpu-1gb-tor1-01.ssh > pool-99-252-115-234.cpe.net.cable.rogers.com.42082: Flags [P.], seq 69656:69692, ack 37, win 501, options [nop,nop,TS val 4229786272 ecr 1279667170], length 36
21:12:35.867290 IP pool-99-252-115-234.cpe.net.cable.rogers.com.42082 > lamponubuntu2204-s-1vcpu-1gb-tor1-01.ssh: Flags [.], ack 61068, win 1623, options [nop,nop,TS val 1279667260 ecr 4229786270], length 0
21:12:35.867291 IP pool-99-252-115-234.cpe.net.cable.rogers.com.42082 > lamponubuntu2204-s-1vcpu-1gb-tor1-01.ssh: Flags [.], ack 69692, win 1573, options [nop,nop,TS val 1279667265 ecr 4229786271], length 0
21:12:35.875589 IP 173-248-237-221.static.imsbiz.com.60356 > lamponubuntu2204-s-1vcpu-1gb-tor1-01.ssh: Flags [S], seq 2146175203, win 29200, options [mss 1460,sackOK,TS val 1361775933 ecr 0,nop,wscale 7], length 0
21:12:35.875663 IP lamponubuntu2204-s-1vcpu-1gb-tor1-01.ssh > 173-248-237-221.static.imsbiz.com.60356: Flags [S.], seq 1687093043, ack 2146175204, win 65160, options [mss 1460,sackOK,TS val 3326112548 ecr 1361775933,nop,wscale 7], length 0
21:12:35.954531 IP lamponubuntu2204-s-1vcpu-1gb-tor1-01.ssh > pool-99-252-115-234.cpe.net.cable.rogers.com.42082: Flags [P.], seq 69692:69952, ack 37, win 501, options [nop,nop,TS val 4229786372 ecr 1279667265], length 260
21:12:35.954705 IP lamponubuntu2204-s-1vcpu-1gb-tor1-01.ssh > pool-99-252-115-234.cpe.net.cable.rogers.com.42082: Flags [P.], seq 69952:70436, ack 37, win 501, options [nop,nop,TS val 4229786372 ecr 1279667265], length 484
21:12:35.954830 IP lamponubuntu2204-s-1vcpu-1gb-tor1-01.ssh > pool-99-252-115-234.cpe.net.cable.rogers.com.42082: Flags [P.], seq 70436:70920, ack 37, win 501, options [nop,nop,TS val 4229786372 ecr 1279667265], length 484
21:12:35.954943 IP lamponubuntu2204-s-1vcpu-1gb-tor1-01.ssh > pool-99-252-115-234.cpe.net.cable.rogers.com.42082: Flags [P.], seq 70920:71628, ack 37, win 501, options [nop,nop,TS val 4229786372 ecr 1279667265], length 708
21:12:35.955055 IP lamponubuntu2204-s-1vcpu-1gb-tor1-01.ssh > pool-99-252-115-234.cpe.net.cable.rogers.com.42082: Flags [P.], seq 71628:72336, ack 37, win 501, options [nop,nop,TS val 4229786372 ecr 1279667265], length 708
21:12:35.955166 IP lamponubuntu2204-s-1vcpu-1gb-tor1-01.ssh > pool-99-252-115-234.cpe.net.cable.rogers.com.42082: Flags [P.], seq 72336:73044, ack 37, win 501, options [nop,nop,TS val 4229786373 ecr 1279667265], length 708
21:12:35.955257 IP lamponubuntu2204-s-1vcpu-1gb-tor1-01.ssh > pool-99-252-115-234.cpe.net.cable.rogers.com.42082: Flags [P.], seq 73044:73528, ack 37, win 501, options [nop,nop,TS val 4229786373 ecr 1279667265], length 484
21:12:35.955362 IP lamponubuntu2204-s-1vcpu-1gb-tor1-01.ssh > pool-99-252-115-234.cpe.net.cable.rogers.com.42082: Flags [P.], seq 73528:74236, ack 37, win 501, options [nop,nop,TS val 4229786373 ecr 1279667265], length 708
21:12:35.955457 IP lamponubuntu2204-s-1vcpu-1gb-tor1-01.ssh > pool-99-252-115-234.cpe.net.cable.rogers.com.42082: Flags [P.], seq 74236:74720, ack 37, win 501, options [nop,nop,TS val 4229786373 ecr 1279667265], length 484
21:12:35.955556 IP lamponubuntu2204-s-1vcpu-1gb-tor1-01.ssh > pool-99-252-115-234.cpe.net.cable.rogers.com.42082: Flags [P.], seq 74720:75428, ack 37, win 501, options [nop,nop,TS val 4229786373 ecr 1279667265], length 708
21:12:35.955664 IP lamponubuntu2204-s-1vcpu-1gb-tor1-01.ssh > pool-99-252-115-234.cpe.net.cable.rogers.com.42082: Flags [P.], seq 75428:76136, ack 37, win 501, options [nop,nop,TS val 4229786373 ecr 1279667265], length 708
21:12:35.955750 IP lamponubuntu2204-s-1vcpu-1gb-tor1-01.ssh > pool-99-252-115-234.cpe.net.cable.rogers.com.42082: Flags [P.], seq 76136:76620, ack 37, win 501, options [nop,nop,TS val 4229786373 ecr 1279667265], length 484
21:12:35.955841 IP lamponubuntu2204-s-1vcpu-1gb-tor1-01.ssh > pool-99-252-115-234.cpe.net.cable.rogers.com.42082: Flags [P.], seq 76620:77104, ack 37, win 501, options [nop,nop,TS val 4229786373 ecr 1279667265], length 484
21:12:35.955925 IP lamponubuntu2204-s-1vcpu-1gb-tor1-01.ssh > pool-99-252-115-234.cpe.net.cable.rogers.com.42082: Flags [P.], seq 77104:77588, ack 37, win 501, options [nop,nop,TS val 4229786373 ecr 1279667265], length 484
21:12:35.956027 IP lamponubuntu2204-s-1vcpu-1gb-tor1-01.ssh > pool-99-252-115-234.cpe.net.cable.rogers.com.42082: Flags [P.], seq 77588:78296, ack 37, win 501, options [nop,nop,TS val 4229786373 ecr 1279667265], length 708
21:12:35.956112 IP lamponubuntu2204-s-1vcpu-1gb-tor1-01.ssh > pool-99-252-115-234.cpe.net.cable.rogers.com.42082: Flags [P.], seq 78296:78780, ack 37, win 501, options [nop,nop,TS val 4229786373 ecr 1279667265], length 484
21:12:35.956199 IP lamponubuntu2204-s-1vcpu-1gb-tor1-01.ssh > pool-99-252-115-234.cpe.net.cable.rogers.com.42082: Flags [P.], seq 78780:79264, ack 37, win 501, options [nop,nop,TS val 4229786374 ecr 1279667265], length 484
21:12:35.956308 IP lamponubuntu2204-s-1vcpu-1gb-tor1-01.ssh > pool-99-252-115-234.cpe.net.cable.rogers.com.42082: Flags [P.], seq 79264:79972, ack 37, win 501, options [nop,nop,TS val 4229786374 ecr 1279667265], length 708
21:12:35.956397 IP lamponubuntu2204-s-1vcpu-1gb-tor1-01.ssh > pool-99-252-115-234.cpe.net.cable.rogers.com.42082: Flags [P.], seq 79972:80424, ack 37, win 501, options [nop,nop,TS val 4229786374 ecr 1279667265], length 452
21:12:35.957061 IP lamponubuntu2204-s-1vcpu-1gb-tor1-01.33864 > 67.207.67.3.domain: 29288+ PTR? 221.237.248.173.in-addr.arpa. (46)
21:12:35.957214 IP lamponubuntu2204-s-1vcpu-1gb-tor1-01.57212 > 67.207.67.3.domain: Flags [P.], seq 92:140, ack 217, win 502, options [nop,nop,TS val 3172956907 ecr 1869484103], length 48 63226+ PTR? 221.237.248.173.in-addr.arpa. (46)
21:12:35.957538 IP lamponubuntu2204-s-1vcpu-1gb-tor1-01.ssh > pool-99-252-115-234.cpe.net.cable.rogers.com.42082: Flags [P.], seq 80424:80460, ack 37, win 501, options [nop,nop,TS val 4229786375 ecr 1279667265], length 36
21:12:35.957670 IP lamponubuntu2204-s-1vcpu-1gb-tor1-01.ssh > pool-99-252-115-234.cpe.net.cable.rogers.com.42082: Flags [P.], seq 80460:80712, ack 37, win 501, options [nop,nop,TS val 4229786375 ecr 1279667265], length 252
21:12:35.957715 IP lamponubuntu2204-s-1vcpu-1gb-tor1-01.ssh > pool-99-252-115-234.cpe.net.cable.rogers.com.42082: Flags [P.], seq 80712:80748, ack 37, win 501, options [nop,nop,TS val 4229786375 ecr 1279667265], length 36
21:12:35.957807 IP lamponubuntu2204-s-1vcpu-1gb-tor1-01.ssh > pool-99-252-115-234.cpe.net.cable.rogers.com.42082: Flags [P.], seq 80748:81024, ack 37, win 501, options [nop,nop,TS val 4229786375 ecr 1279667265], length 276
21:12:35.957845 IP lamponubuntu2204-s-1vcpu-1gb-tor1-01.ssh > pool-99-252-115-234.cpe.net.cable.rogers.com.42082: Flags [P.], seq 81024:81060, ack 37, win 501, options [nop,nop,TS val 4229786375 ecr 1279667265], length 36
21:12:35.958316 IP 67.207.67.3.domain > lamponubuntu2204-s-1vcpu-1gb-tor1-01.33864: 29288 1/0/0 PTR 173-248-237-221.static.imsbiz.com. (93)
21:12:35.959137 IP 67.207.67.3.domain > lamponubuntu2204-s-1vcpu-1gb-tor1-01.57212: Flags [P.], seq 217:312, ack 140, win 128, options [nop,nop,TS val 1869484522 ecr 3172956907], length 95 63226 1/0/0 PTR 173-248-237-221.static.imsbiz.com. (93)
21:12:35.959167 IP lamponubuntu2204-s-1vcpu-1gb-tor1-01.57212 > 67.207.67.3.domain: Flags [.], ack 312, win 502, options [nop,nop,TS val 3172956908 ecr 1869484522], length 0
21:12:35.973121 IP pool-99-252-115-234.cpe.net.cable.rogers.com.42082 > lamponubuntu2204-s-1vcpu-1gb-tor1-01.ssh: Flags [.], ack 81060, win 1558, options [nop,nop,TS val 1279667364 ecr 4229786374], length 0
21:12:36.058427 IP lamponubuntu2204-s-1vcpu-1gb-tor1-01.ssh > pool-99-252-115-234.cpe.net.cable.rogers.com.42082: Flags [P.], seq 81060:81320, ack 37, win 501, options [nop,nop,TS val 4229786476 ecr 1279667364], length 260
21:12:36.058532 IP lamponubuntu2204-s-1vcpu-1gb-tor1-01.ssh > pool-99-252-115-234.cpe.net.cable.rogers.com.42082: Flags [P.], seq 81320:81616, ack 37, win 501, options [nop,nop,TS val 4229786476 ecr 1279667364], length 296
21:12:36.058636 IP lamponubuntu2204-s-1vcpu-1gb-tor1-01.ssh > pool-99-252-115-234.cpe.net.cable.rogers.com.42082: Flags [P.], seq 81616:81948, ack 37, win 501, options [nop,nop,TS val 4229786476 ecr 1279667364], length 332
21:12:36.058695 IP lamponubuntu2204-s-1vcpu-1gb-tor1-01.ssh > pool-99-252-115-234.cpe.net.cable.rogers.com.42082: Flags [P.], seq 81948:82208, ack 37, win 501, options [nop,nop,TS val 4229786476 ecr 1279667364], length 260
21:12:36.058779 IP lamponubuntu2204-s-1vcpu-1gb-tor1-01.ssh > pool-99-252-115-234.cpe.net.cable.rogers.com.42082: Flags [P.], seq 82208:82692, ack 37, win 501, options [nop,nop,TS val 4229786476 ecr 1279667364], length 484
21:12:36.058874 IP lamponubuntu2204-s-1vcpu-1gb-tor1-01.ssh > pool-99-252-115-234.cpe.net.cable.rogers.com.42082: Flags [P.], seq 82692:83400, ack 37, win 501, options [nop,nop,TS val 4229786476 ecr 1279667364], length 708
21:12:36.058949 IP lamponubuntu2204-s-1vcpu-1gb-tor1-01.ssh > pool-99-252-115-234.cpe.net.cable.rogers.com.42082: Flags [P.], seq 83400:83884, ack 37, win 501, options [nop,nop,TS val 4229786476 ecr 1279667364], length 484
21:12:36.059025 IP lamponubuntu2204-s-1vcpu-1gb-tor1-01.ssh > pool-99-252-115-234.cpe.net.cable.rogers.com.42082: Flags [P.], seq 83884:84592, ack 37, win 501, options [nop,nop,TS val 4229786476 ecr 1279667364], length 708
21:12:36.059094 IP lamponubuntu2204-s-1vcpu-1gb-tor1-01.ssh > pool-99-252-115-234.cpe.net.cable.rogers.com.42082: Flags [P.], seq 84592:85300, ack 37, win 501, options [nop,nop,TS val 4229786476 ecr 1279667364], length 708
21:12:36.059148 IP lamponubuntu2204-s-1vcpu-1gb-tor1-01.ssh > pool-99-252-115-234.cpe.net.cable.rogers.com.42082: Flags [P.], seq 85300:85784, ack 37, win 501, options [nop,nop,TS val 4229786476 ecr 1279667364], length 484
21:12:36.059197 IP lamponubuntu2204-s-1vcpu-1gb-tor1-01.ssh > pool-99-252-115-234.cpe.net.cable.rogers.com.42082: Flags [P.], seq 85784:85956, ack 37, win 501, options [nop,nop,TS val 4229786477 ecr 1279667364], length 172
21:12:36.059254 IP lamponubuntu2204-s-1vcpu-1gb-tor1-01.ssh > pool-99-252-115-234.cpe.net.cable.rogers.com.42082: Flags [P.], seq 85956:86456, ack 37, win 501, options [nop,nop,TS val 4229786477 ecr 1279667364], length 500
21:12:36.059307 IP lamponubuntu2204-s-1vcpu-1gb-tor1-01.ssh > pool-99-252-115-234.cpe.net.cable.rogers.com.42082: Flags [P.], seq 86456:86940, ack 37, win 501, options [nop,nop,TS val 4229786477 ecr 1279667364], length 484
21:12:36.059359 IP lamponubuntu2204-s-1vcpu-1gb-tor1-01.ssh > pool-99-252-115-234.cpe.net.cable.rogers.com.42082: Flags [P.], seq 86940:87424, ack 37, win 501, options [nop,nop,TS val 4229786477 ecr 1279667364], length 484
21:12:36.059418 IP lamponubuntu2204-s-1vcpu-1gb-tor1-01.ssh > pool-99-252-115-234.cpe.net.cable.rogers.com.42082: Flags [P.], seq 87424:87604, ack 37, win 501, options [nop,nop,TS val 4229786477 ecr 1279667364], length 180
21:12:36.059506 IP lamponubuntu2204-s-1vcpu-1gb-tor1-01.ssh > pool-99-252-115-234.cpe.net.cable.rogers.com.42082: Flags [P.], seq 87604:88064, ack 37, win 501, options [nop,nop,TS val 4229786477 ecr 1279667364], length 460
21:12:36.059566 IP lamponubuntu2204-s-1vcpu-1gb-tor1-01.ssh > pool-99-252-115-234.cpe.net.cable.rogers.com.42082: Flags [P.], seq 88064:88308, ack 37, win 501, options [nop,nop,TS val 4229786477 ecr 1279667364], length 244
21:12:36.087596 IP pool-99-252-115-234.cpe.net.cable.rogers.com.42082 > lamponubuntu2204-s-1vcpu-1gb-tor1-01.ssh: Flags [.], ack 88308, win 1558, options [nop,nop,TS val 1279667467 ecr 4229786477], length 0
21:12:36.089959 IP 173-248-237-221.static.imsbiz.com.60356 > lamponubuntu2204-s-1vcpu-1gb-tor1-01.ssh: Flags [.], ack 1, win 229, options [nop,nop,TS val 1361776148 ecr 3326112548], length 0
21:12:36.089959 IP 173-248-237-221.static.imsbiz.com.60356 > lamponubuntu2204-s-1vcpu-1gb-tor1-01.ssh: Flags [P.], seq 1:23, ack 1, win 229, options [nop,nop,TS val 1361776148 ecr 3326112548], length 22: SSH: SSH-2.0-libssh_0.9.6
21:12:36.090046 IP lamponubuntu2204-s-1vcpu-1gb-tor1-01.ssh > 173-248-237-221.static.imsbiz.com.60356: Flags [.], ack 23, win 509, options [nop,nop,TS val 3326112762 ecr 1361776148], length 0
21:12:36.102457 IP lamponubuntu2204-s-1vcpu-1gb-tor1-01.ssh > 173-248-237-221.static.imsbiz.com.60356: Flags [P.], seq 1:43, ack 23, win 509, options [nop,nop,TS val 3326112775 ecr 1361776148], length 42: SSH: SSH-2.0-OpenSSH_8.9p1 Ubuntu-3ubuntu0.10
21:12:36.162751 IP lamponubuntu2204-s-1vcpu-1gb-tor1-01.ssh > pool-99-252-115-234.cpe.net.cable.rogers.com.42082: Flags [P.], seq 88308:92440, ack 37, win 501, options [nop,nop,TS val 4229786580 ecr 1279667467], length 4132
21:12:36.162830 IP lamponubuntu2204-s-1vcpu-1gb-tor1-01.ssh > pool-99-252-115-234.cpe.net.cable.rogers.com.42082: Flags [P.], seq 92440:93268, ack 37, win 501, options [nop,nop,TS val 4229786580 ecr 1279667467], length 828
21:12:36.210236 IP lamponubuntu2204-s-1vcpu-1gb-tor1-01.ssh > pool-99-252-115-234.cpe.net.cable.rogers.com.42082: Flags [P.], seq 92440:93268, ack 37, win 501, options [nop,nop,TS val 4229786628 ecr 1279667467], length 828
21:12:36.236634 IP pool-99-252-115-234.cpe.net.cable.rogers.com.42082 > lamponubuntu2204-s-1vcpu-1gb-tor1-01.ssh: Flags [.], ack 92440, win 1688, options [nop,nop,TS val 1279667628 ecr 4229786580], length 0
21:12:36.243080 IP pool-99-252-115-234.cpe.net.cable.rogers.com.42082 > lamponubuntu2204-s-1vcpu-1gb-tor1-01.ssh: Flags [.], ack 93268, win 1710, options [nop,nop,TS val 1279667628 ecr 4229786628,nop,nop,sack 1 {92440:93268}], length 0
21:12:36.266533 IP lamponubuntu2204-s-1vcpu-1gb-tor1-01.ssh > pool-99-252-115-234.cpe.net.cable.rogers.com.42082: Flags [P.], seq 93268:94424, ack 37, win 501, options [nop,nop,TS val 4229786684 ecr 1279667628], length 1156
21:12:36.277762 IP pool-99-252-115-234.cpe.net.cable.rogers.com.42082 > lamponubuntu2204-s-1vcpu-1gb-tor1-01.ssh: Flags [.], ack 94424, win 1733, options [nop,nop,TS val 1279667675 ecr 4229786684], length 0
21:12:36.322296 IP 173-248-237-221.static.imsbiz.com.60356 > lamponubuntu2204-s-1vcpu-1gb-tor1-01.ssh: Flags [.], ack 43, win 229, options [nop,nop,TS val 1361776380 ecr 3326112775], length 0
21:12:36.322297 IP 173-248-237-221.static.imsbiz.com.60356 > lamponubuntu2204-s-1vcpu-1gb-tor1-01.ssh: Flags [P.], seq 23:999, ack 43, win 229, options [nop,nop,TS val 1361776380 ecr 3326112775], length 976
21:12:36.322360 IP lamponubuntu2204-s-1vcpu-1gb-tor1-01.ssh > 173-248-237-221.static.imsbiz.com.60356: Flags [P.], seq 43:1155, ack 23, win 509, options [nop,nop,TS val 3326112995 ecr 1361776380], length 1112
21:12:36.366257 IP lamponubuntu2204-s-1vcpu-1gb-tor1-01.ssh > 173-248-237-221.static.imsbiz.com.60356: Flags [.], ack 999, win 502, options [nop,nop,TS val 3326113039 ecr 1361776380], length 0
21:12:36.370468 IP lamponubuntu2204-s-1vcpu-1gb-tor1-01.ssh > pool-99-252-115-234.cpe.net.cable.rogers.com.42082: Flags [P.], seq 94424:95700, ack 37, win 501, options [nop,nop,TS val 4229786788 ecr 1279667675], length 1276
21:12:36.443984 IP pool-99-252-115-234.cpe.net.cable.rogers.com.42082 > lamponubuntu2204-s-1vcpu-1gb-tor1-01.ssh: Flags [.], ack 95700, win 1756, options [nop,nop,TS val 1279667833 ecr 4229786788], length 0
21:12:36.474425 IP lamponubuntu2204-s-1vcpu-1gb-tor1-01.ssh > pool-99-252-115-234.cpe.net.cable.rogers.com.42082: Flags [P.], seq 95700:96168, ack 37, win 501, options [nop,nop,TS val 4229786892 ecr 1279667833], length 468
21:12:36.487204 IP pool-99-252-115-234.cpe.net.cable.rogers.com.42082 > lamponubuntu2204-s-1vcpu-1gb-tor1-01.ssh: Flags [.], ack 96168, win 1778, options [nop,nop,TS val 1279667881 ecr 4229786892], length 0
21:12:36.575973 IP 173-248-237-221.static.imsbiz.com.60356 > lamponubuntu2204-s-1vcpu-1gb-tor1-01.ssh: Flags [.], ack 1155, win 246, options [nop,nop,TS val 1361776634 ecr 3326112995], length 0
21:12:36.578494 IP lamponubuntu2204-s-1vcpu-1gb-tor1-01.ssh > pool-99-252-115-234.cpe.net.cable.rogers.com.42082: Flags [P.], seq 96168:96836, ack 37, win 501, options [nop,nop,TS val 4229786996 ecr 1279667881], length 668
21:12:36.586697 IP 173-248-237-221.static.imsbiz.com.60356 > lamponubuntu2204-s-1vcpu-1gb-tor1-01.ssh: Flags [P.], seq 999:1047, ack 1155, win 246, options [nop,nop,TS val 1361776644 ecr 3326113039], length 48
21:12:36.586753 IP lamponubuntu2204-s-1vcpu-1gb-tor1-01.ssh > 173-248-237-221.static.imsbiz.com.60356: Flags [.], ack 1047, win 502, options [nop,nop,TS val 3326113259 ecr 1361776644], length 0
21:12:36.593490 IP lamponubuntu2204-s-1vcpu-1gb-tor1-01.ssh > 173-248-237-221.static.imsbiz.com.60356: Flags [P.], seq 1155:1687, ack 1047, win 502, options [nop,nop,TS val 3326113266 ecr 1361776644], length 532
21:12:36.644848 IP pool-99-252-115-234.cpe.net.cable.rogers.com.42082 > lamponubuntu2204-s-1vcpu-1gb-tor1-01.ssh: Flags [.], ack 96836, win 1801, options [nop,nop,TS val 1279668037 ecr 4229786996], length 0
21:12:36.682527 IP lamponubuntu2204-s-1vcpu-1gb-tor1-01.ssh > pool-99-252-115-234.cpe.net.cable.rogers.com.42082: Flags [P.], seq 96836:97928, ack 37, win 501, options [nop,nop,TS val 4229787100 ecr 1279668037], length 1092
21:12:36.697197 IP pool-99-252-115-234.cpe.net.cable.rogers.com.42082 > lamponubuntu2204-s-1vcpu-1gb-tor1-01.ssh: Flags [.], ack 97928, win 1823, options [nop,nop,TS val 1279668090 ecr 4229787100], length 0
^C
383 packets captured
387 packets received by filter
0 packets dropped by kernel

